sentence;url;place;lat;lon;sentiment_score;sentiment
migrants are separated by chain-linked fencing according to age and gender — with young siblings split up — for up to 72 hours.;https://www.juancole.com/2018/06/children-screaming-mothers.html;Uruguay;-33.0;-56.0;0.1;positive
refugees and are ensuring partners are trained on how to work with LGBTI in a displacement context.;https://www.nbcnews.com/feature/nbc-out/following-pride-event-kenya-s-gay-refugees-fear-their-lives-n885136?cid=public-rss_20180622;South Sudan;15.0;30.0;0.0;neutral
refugee is nowhere near coextensive with the Church’s definition.;https://www.catholicworldreport.com/2018/06/21/making-sense-of-u-s-immigration-law-enforcement-and-the-current-crisis/;United Kingdom;54.0;-2.0;0.1;positive
refugees is reportedly increasing as long-standing conflicts have forced many citizens from the Democratic Republic of Congo and South Sudan to cross the Uganda border.;https://www.adventistreview.org/church-news/story6229-adra-helps-feed-85000-refugees-in-uganda;Congo, The Democratic Republic of the;0.0;25.0;0.067;positive
migrant families is a question of terminology: Are the shelters where the migrants are housed correctly described as “concentration camps”?;https://azjewishpost.com/2018/detention-facilities-or-concentration-camps-a-debate-on-names-invokes-the-nazis/;Germany;51.0;9.0;0.0;neutral
migrants are detained ― requires Immigration and Customs Enforcement to release children from family detention centers within 20 days.;https://www.huffingtonpost.com/entry/judge-to-decide-on-family-separations-at-border-as-early-as-wednesday_us_5b2d5ee5e4b0321a01d114a2;United States;38.0;-97.0;0.0;neutral
migrant problem is to start a colony somewhere in Central America or the Caribbean which wouldn’t quite be a US territory but rather a protectorate the way the British handled Singapore or Hong Kong — and run in a similar manner.;https://spectator.org/the-childrens-crisis-isnt-working/;Singapore;1.37;103.8;0.0;neutral
refugee population is thus expected to grow in perpetuity, while all other refugee populations served by the UNHCR — which focuses on resettlement — eventually shrink.;https://www.algemeiner.com/2018/06/21/south-african-trade-group-bds-activists-promote-palestinian-refugees-with-photo-of-jewish-refugees-from-arab-lands/;Tunisia;34.0;9.0;-0.113;negative
migrants were not among the children recently separated from their families at the border, the news comes as the Trump administration faces the fallout from its zero tolerance immigration policy.;http://freerepublic.com/focus/f-news/3665241/posts;United States;38.0;-97.0;0.0;neutral
refugees are now in all neighbouring countries and of course in Turkey, and in Greece and across Europe.;http://www.dailymail.co.uk/wires/pa/article-5875605/Corbyn-UK-migrant-resettlement-schemes-Brexit.html;Turkey;39.0;35.0;0.0;neutral
migrants are somehow less than human:;https://sandiegofreepress.org/2018/06/immigration-protests-the-whole-world-is-watching-progressive-activist-calendar-june-22-july-2-2018/;United States;38.0;-97.0;-0.083;negative
asylum seekers are now being caught between international legal obligations regarding asylum and US politics.;https://www.undispatch.com/this-is-the-dawning-of-the-the-age-of-the-aquarius/;Honduras;15.0;-86.5;0.1;positive
migrant process is a grueling, multi-step, dehumanizing affair.;https://mic.com/articles/189954/how-a-dollar1500-fundraiser-for-immigrants-ballooned-to-dollar18-million-and-what-will-happen-with-the-money;United States;38.0;-97.0;0.0;neutral
refugees are celebrating their new citizenship.;https://www.yourerie.com/news/local-news/erie-is-home-to-50-new-american-citizens-following-today-s-naturalization-ceremony/1256646639;United States;38.0;-97.0;0.136;positive
migrant adults are often taken to shelters separately until they can be reunited with their parents, a family member, or a sponsor.;http://www.breitbart.com/texas/2018/06/21/fake-news-iconic-crying-migrant-girl-was-never-separated-from-mother-says-father/;United States;38.0;-97.0;0.0;neutral
refugees is mirrored by homeowner Vanessa Fineberg’s diverse and vibrant tastes.;https://buffalo.com/2018/06/22/a-west-side-victorians-eclectic-spirit/;United States;38.0;-97.0;0.167;positive
migrants are Syrians;http://pundita.blogspot.com/2018/06/hair-raising-story-of-germanys.html;Jordan;31.0;36.0;0.0;neutral
migrant children are known to have been separated from their parents at the border since May.;http://lifestyle.inquirer.net/298234/us-first-lady-melania-trump-criticized-for-wearing-i-dont-care-jacket-in-border-visit/;United States;38.0;-97.0;0.0;neutral
migrants is rarely off our screens these days, even in this, Refugee Week.;http://www.thenationalstudent.com/Health/2018-06-22/what_to_do_about_migrants_mental_health.html;Mexico;23.0;-102.0;0.3;positive
migrants are reported to have drowned off Libya in two days, bringing to at least 1,000 the number to die this year on the main migratory route linking Africa and Europe, the UN said yesterday.;http://www.manilatimes.net/more-than-1000-migrants-drowned-in-mediterranean-in-2018/411356/;Central African Republic;7.0;21.0;-0.078;negative
migrant children are on their flights and how to respond to passenger inquiries.;https://www.nbcnews.com/storyline/immigration-border-crisis/airlines-ask-government-refrain-using-them-fly-migrant-children-n885086?cid=public-rss_20180622;United States;38.0;-97.0;0.0;neutral
Asylum seekers are defined as people who have sought international protection and whose claim for refugee status has not yet been determined.;http://newsday.co.tt/2018/06/21/please-let-us-stay/;China;35.0;105.0;0.0;neutral
Refugee Agency, is shocked and saddened by reports that some 220 people drowned off Libya in recent days while attempting to cross the Mediterranean Sea to Europe.;http://www.pressreleasepoint.com/unhcr-shocked-mass-drownings-libya-calls-urgent-action;United States;38.0;-97.0;-0.2;negative
refugees who are really economic migrants looking for a free lunch “will be seized” to determine their legal status according to Italy.;https://www.armstrongeconomics.com/uncategorized/italy-refugee-crisis/;Italy;42.83;12.83;0.267;positive
migrants are rushing the border, more kids are being separated from their parents.;https://www.newsbusters.org/blogs/nb/ryan-foley/2018/06/22/msnbc-guest-donald-trump-pure-evil-people-are-dying-right-now-because;Mexico;23.0;-102.0;0.5;positive
migrants it is detaining,” writes Abigail Abrams for Time.;https://www.mansworldindia.com/fashion/melania-trumps-dont-care-jacket-leaves-netizens-outraged/;United States;38.0;-97.0;0.0;neutral
migrant families is needed, but obstacles have piled up.;http://thehill.com/homenews/morning-report/393593-the-hills-morning-report-immigration-Krauthammer-melania-trump;United States;38.0;-97.0;-0.05;negative
refugee claims are adjudicated by ICE.;http://observer.com/2018/06/talia-lavin-falsely-claiming-justin-gaertner-nazi-helps-trump/;Germany;51.0;9.0;0.0;neutral
refugees are 'at risk of landslides and floods during the current monsoon season,' which already has damaged over 3,000 shelters.;https://www.bignewsnetwork.com/news/257524829/amnesty-international-calls-for-rohingya-aid-on-world-refugee-day;Myanmar;22.0;98.0;0.0;neutral
migrant parents are held in detention centers around the country, awaiting having their cases heard - and word on whether they will be reunited with their children.;http://www.dailymail.co.uk/news/article-5875165/Asylum-cases-rose-39-year-Trump-administration-nearly-two-thirds-denied.html;United States;38.0;-97.0;0.0;neutral
refugees are detained in Canada only as a last resort and new measures will soon be introduced to offer alternatives to detaining migrants.;http://www.thecaribbeancamera.com/community-events/morally-bankrupt/;Canada;60.0;-95.0;0.045;positive
Asylum seekers are blamed for bringing detention upon themselves, and more reprehensibly, on their children.;https://www.laketahoenews.net/2018/06/opinion-trumps-tent-city-for-children-is-a-concentration-camp/;Germany;51.0;9.0;0.5;positive
migrants is implemented with dispatch, observers say it “won’t make a difference” for thousands of children confined in shelters.;https://opinion.inquirer.net/114095/a-traumatized-generation;Philippines;13.0;122.0;0.0;neutral
migrants there are subject to indefinite detention, physical abuse, forced labour and extortion.Lifeline spokesman Axel Steier said the migrants on its boat included 14 women and four small children.;http://www.defenceweb.co.za/index.php?option=com_content&view=article&id=52133:italian-stance-on-migrants-appears-to-change&catid=87:border-security&Itemid=188;Italy;42.83;12.83;-0.179;negative
refugees are allowed into Europe.;https://www.siasat.com/news/italian-minister-slams-charity-rescuing-migrants-1372130/;Germany;51.0;9.0;0.0;neutral
migrant is a danger to the community or a flight risk.;https://www.vox.com/2018/6/22/17483230/family-separation-immigration-alternatives-immigrant-detention-centers;United States;38.0;-97.0;0.0;neutral
"migrants are human too"" and ""Keep families together.""";https://www.sfgate.com/news/article/Two-powerful-forces-meet-at-the-US-Mexico-border-13018482.php;United States;38.0;-97.0;0.0;neutral
"refugees are ""bottom-feeding leeches"".";https://www.nzherald.co.nz/nz/news/article.cfm?c_id=1&objectid=12075842;Mexico;23.0;-102.0;0.0;neutral
migrants who are not entitled to protection are returned to their country of origin.;https://www.politico.eu/article/europe-migration-crisis-fight-explained/;Hong Kong;22.25;114.17;0.0;neutral
migrant children are housed in shelters nationwide funded by grants from the U.S. Office of Refugee Resettlement.;https://www.revealnews.org/blog/surprise-visit-by-first-lady-includes-migrant-youth-center-cited-for-deficiencies-by-state/;United States;38.0;-97.0;0.0;neutral
refugee crisis is staggering;https://www.tipperarystar.ie/news/home/319957/tipperary-libraries-raising-awareness-of-world-refugee-day.html;Afghanistan;33.0;65.0;0.0;neutral
migrants are needed to continue to drive growth in the workforce.;https://www.marketwatch.com/story/economists-say-30-years-of-data-show-asylum-seekers-are-not-a-burden-on-european-countries-2018-06-22;United States;38.0;-97.0;0.0;neutral
asylum seekers are escaping?;http://www.golocalprov.com/politics/bishop-justice-isnt-made-at-the-borders;United States;38.0;-97.0;0.0;neutral
refugee families are establishing roots and are becoming more likely to buy than rent.;https://www.kshb.com/news/local-news/more-people-moving-to-kck-for-affordable-housing-community-advocates-say;United States;38.0;-97.0;0.317;positive
migrant families are 'lucky we aren't executing them';https://www.stripes.com/news/guardsman-disciplined-for-post-saying-migrant-families-are-lucky-we-aren-t-executing-them-1.534194;United States;38.0;-97.0;0.333;positive
"refugees are going through year after,year so I thought I would give it a go,"" Ms Vile said.";https://www.armidaleexpress.com.au/story/5484764/citys-residents-hungry-for-change-tackling-2018-ration-challenge/?cs=471;Australia;-27.0;133.0;0.0;neutral
migrant crisis is reopening a front that further complicates the unity of the bloc;http://www.marxist.com/the-migrant-crisis-and-fortress-europe.htm;Burkina Faso;13.0;-2.0;0.0;neutral
migrant parents not to bring their children across the border illegally.;https://www.sott.net/article/388899-Poll-finds-majority-of-Americans-support-Trump-and-blame-immigrant-parents-for-child-detention-crisis;Australia;-27.0;133.0;-0.5;negative
refugees is “very, very small compared to any other European country.”;http://montrealgazette.com/pmn/news-pmn/corbyn-a-labor-government-would-quickly-recognize-palestine/wcm/502a2aad-fbb3-41d8-a026-5cabb99f4e07;Germany;51.0;9.0;-0.15;negative
asylum seekers are granted NOK 2,447 ($302) per person on a monthly basis.;https://sputniknews.com/europe/201806221065661714-norway-hunger-migrants/;Norway;62.0;10.0;0.0;neutral
refugees had not been fulfilled yet, noting that voluntary repatriation might not take place in safety and dignity.;http://www.presstv.com/Detail/2018/06/22/565751/Merkel-Beirut-Syria-refugees-Hariri;Germany;51.0;9.0;0.0;neutral
"Asylum seekers are supposed to apply for asylum in the ""first safe country"" they enter which, except for Mexicans, is not the USA.";https://www.cityweekly.net/utah/feedback-from-june-7-and-beyond/Content?oid=9410070;Mexico;23.0;-102.0;0.375;positive
refugees did not create the current situation?;http://www.informationclearinghouse.info/49699.htm;Guatemala;15.5;-90.25;0.0;neutral
migrants are managing to overturn UK Government visa refusals after a judicial review – contrary to what Immigration Minister Caroline Noakes told MPs.;http://www.thenational.scot/politics/16307007.Further_proof_emerges_to_disprove_Tory_MP_s_immigration_claim/;United Kingdom;54.0;-2.0;0.0;neutral
migrants are returned home in dignity and with enough resources to restart their lives.;https://nation.com.pk/22-Jun-2018/eu-says-no-guantanamo-bay-for-migrants-outside-bloc;Tunisia;34.0;9.0;0.0;neutral
refugee camp is not,” said Matteo Salvini, Italy’s deputy prime minister, in a tweet.;http://lfpress.com/opinion/columnists/dyer-climate-change-will-precipitate-migrant-apocalypse;Italy;42.83;12.83;0.0;neutral
refugees is their return to Syria in safety and dignity,” Hariri said at a joint press conference in Beirut with German Chancellor Angela Merkel.;http://www.naharnet.com/stories/en/247566-hariri-merkel-agree-on-safe-return-of-syrian-refugees;Lebanon;33.83;35.83;0.0;neutral
refugee policy is under increasing pressure due to their large number in the country and hence an overstretch on the available resources.;http://allafrica.com/stories/201806220348.html;Kenya;1.0;38.0;0.163;positive
migrants are being forced to wait for days or longer in Mexico.”;https://whatdidyousay.org/2018/06/21/this-weeks-ann-coulter-letter-google-internet-media/;Mexico;23.0;-102.0;-0.3;negative
migrants are now using another route, across the Mediterranean rather than the Agean.;https://www.independent.co.uk/voices/switzerland-tunisia-tourism-immigration-laws-local-economy-a8412236.html;Mexico;23.0;-102.0;0.0;neutral
refugees are included in State sponsored social protection programmes” but government funding, nevertheless could not meet all the needs of PoC, he added.;http://www.ghananewsagency.org/social/b-a-coordinator-of-grb-commends-ncs-and-adra-134511;Afghanistan;33.0;65.0;0.033;positive
refugee camps is not addressed, degraded soils and water shortages could render local farmers and fishermen destitute and force more people to leave their homes, experts said.;https://www.sightmagazine.com.au/news/9668-plant-trees-in-refugee-camps-to-stop-forest-loss-and-conflict-un-says;Switzerland;47.0;8.0;0.25;positive
migrants who are in the country illegally after being brought here as children, commonly known as DREAMers.;http://celebcafe.org/u-s-house-oks-farm-bill-with-major-food-stamps-changes-4752/;United States;38.0;-97.0;-0.4;negative
asylum seekers are targeted most.;https://theuglytruth.wordpress.com/2018/06/22/activists-warn-that-more-and-more-israeli-jews-are-coming-out-as-anti-arab-racists-with-politicians-setting-the-tone/;Israel;31.5;34.75;0.5;positive
migrants are given cheap, poor-quality food while being forced to wear soiled underwear.;https://www.mintpressnews.com/dont-kid-yourselves-us-immigration-prisons-are-absolutely-concentration-camps/244589/;Honduras;15.0;-86.5;0.05;positive
migrants are attempting to escape.It's worth re-examining America's history as a de facto colonial power in countries where current migrants are coming from.;https://www.sott.net/article/388864-Not-just-in-America-Canada-breaks-up-families-too;United States;38.0;-97.0;0.15;positive
migrant children are a federal matter, outside DCS jurisdiction, said agency spokesman Darren DaRonco.;https://www.azcentral.com/story/news/politics/immigration/2018/06/21/kids-separated-migrant-parents-can-use-your-help-heres-how/722539002/;United States;38.0;-97.0;0.0;neutral
migrant children are then released to a parent or other relative living within the United States.;https://www.yahoo.com/news/migrant-children-report-physical-verbal-215147466.html;Honduras;15.0;-86.5;-0.062;negative
asylum seekers are to be housed by the United States “indefinitely,” under lock and key.;https://goodmenproject.com/featured-content/autocracy-now-lbkr/;United States;38.0;-97.0;0.0;neutral
migrants is important to both the European Union as a political entity and the individual member states.;http://www.borgenmagazine.com/language-education-programs-for-migrants/;Germany;51.0;9.0;0.1;positive
refugee problem is in fact part of the reason that an Israeli-Palestinian peace remains elusive.;https://legalinsurrection.com/2018/06/oops-anti-israel-south-african-union-tweets-photo-of-jewish-refugees-from-arab-countries-to-commemorate-palestinian-refugees/;Israel;31.5;34.75;0.0;neutral
Refugee week is supposed to celebrate the immense contribution made by refugees and asylum seekers to our communities and remind ourselves why people need to seek sanctuary.;http://www.politics.co.uk/comment-analysis/2018/06/22/outrage-at-trump-is-fine-but-may-s-hostile-environment-deser;United States;38.0;-97.0;0.0;neutral
migrants there are subject to indefinite detention, physical abuse, slavery and extortion.;http://www.dw.com/en/italy-to-seize-german-ngo-rescue-ship-carrying-226-migrants/a-44342405;Germany;51.0;9.0;-0.083;negative
Refugee camps, is of major concern to UNICEF and partners and bodes significant threats of potential outbreaks.;https://reliefweb.int/report/sudan/unicef-sudan-humanitarian-situation-report-may-2018;Sudan;15.0;30.0;0.146;positive
"migrant children are housed, she asked how she could help the children reunite with their families ""as quickly as possible.""";https://www.nbcnews.com/storyline/immigration-border-crisis/charges-are-dropped-against-17-immigrants-now-they-have-find-n885391?cid=public-rss_20180622;United States;38.0;-97.0;0.0;neutral
asylum seekers who are already in Europe until he has commitments from other member states to help Italy deal with new arrivals.;https://www.msn.com/en-us/news/world/salvini-tells-germany-the-next-year-will-determine-future-of-eu/ar-AAz0WN6;Italy;42.83;12.83;0.006;positive
refugees are a threat to a tolerant society;https://www.middleeastmonitor.com/20180622-in-london-theatre-is-helping-four-young-refugees-process-trauma/;Chad;15.0;19.0;0.0;neutral
migrants are being held in detention far longer, as many initially denied bond by ICE are forced to await the outcome of subsequent bond hearings in court.;https://www.irishexaminer.com/breakingnews/views/analysis/us-policy-puts-people-in-cages-who-are-not-harmful-to-society-850400.html;United States;38.0;-97.0;0.06;positive
"migrants are being detained, and their families are being separated, meets those definitions,"" ReverbPress said.";http://www.politifact.com/punditfact/article/2018/jun/22/facts-behind-headline-portraying-dire-account-chil/;Germany;51.0;9.0;0.0;neutral
migrants are apprehended but then released under the condition that they appear for a scheduled hearing.;https://www.dailysignal.com/2018/06/21/conservative-lawmakers-offer-solution-to-child-separations-without-amnesty/;United States;38.0;-97.0;0.0;neutral
migrants there are subject to indefinite detention, physical abuse, forced labor and extortion.;http://www.customstoday.com.pk/italy-tells-rescue-ship-to-take-migrants-to-the-netherlands/;Germany;51.0;9.0;-0.156;negative
refugees are granted asylum in Japan, with only 20 refugees accepted out of almost 20,000 asylum applications in 2017.;http://www.refworld.org/docid/5b2cb8684.html;Japan;36.0;138.0;0.0;neutral
refugee children are “more important” than American children.;https://www.rawstory.com/2018/06/watch-stephanie-ruhle-destroy-foxs-brian-kilmeade-claiming-kids-valuable-others/;United States;38.0;-97.0;0.3;positive
Refugee camps are often planned by aid organisations but the difference in Bangladesh is that this was not planned out in anyway and it has just become an area where “literally hoards of people” are lodging themselves.;http://clarechampion.ie/a-race-against-time-for-rohingyas/;Bangladesh;24.0;90.0;0.0;neutral
refugees are being taught.;http://www.dailycal.org/2018/06/22/1951-coffee-company-holds-event-celebrating-world-refugee-day/;United States;38.0;-97.0;0.0;neutral
migrants is common to both sides of the Atlantic.;https://www.theguardian.com/world/2018/jun/22/as-immigration-crisis-explodes-xenophobes-gain-ground-in-eu;United States;38.0;-97.0;-0.3;negative
refugees are seen as ‘infiltrators’ and a ‘cancer’, Isayas is a refugee attempting to change the situation on the ground.;http://documentarybox.com/activate-israel-no-place-to-go/;Israel;31.5;34.75;0.0;neutral
"Migrants are ""trying to find new paths to get to European Union countries"" after nations along the route up from Turkey and Greece significantly increased their border security";https://uk.news.yahoo.com/poverty-stricken-albania-migrant-gateway-eu-031115828.html;Turkey;39.0;35.0;0.17;positive
"refugees are exaggerated in their claims that Koreans are in danger of terrorism because of the Yemenis,"" the statement reads.";http://www.koreatimes.co.kr/www/culture/2018/06/293_251119.html;Malaysia;2.5;112.5;-0.5;negative
asylum seekers is straining the infrastructure of places like Toronto which is where most of the asylum seekers want to go.;http://www.canindia.com/us-immigration-crisis-could-see-more-canada-bound-migrants/;Canada;60.0;-95.0;0.5;positive
asylum seeker crisis is that they must engage in the mass detention of children (either separated or with their parents) because that’s the only way to ensure compliance with the law.;https://www.vox.com/2018/6/22/17488272/open-borders-myth;United States;38.0;-97.0;0.0;neutral
"migrants are a problem security reasons, and those who are Italian, ""unfortunately"", we have to bear, as the minister says.";https://sputniknews.com/analysis/201806221065664144-roma-debate-italy/;Italy;42.83;12.83;-0.25;negative
migrant children are being held in cages made out of wire and net.;https://www.counterpunch.org/2018/06/22/none-of-us-are-free-one-of-us-is-chained/;Italy;42.83;12.83;0.0;neutral
refugee camps are sites of entrepreneurship;https://www.lowyinstitute.org/the-interpreter/resiliency-no-excuse-refugee-crisis;Kenya;1.0;38.0;0.0;neutral
refugees were not allowed to come back to their homes because you came back to yours.;https://forward.com/opinion/403843/yossi-klein-halevi-asks-me-to-recognize-his-humanity-can-he-do-the-same/;Israel;31.5;34.75;0.0;neutral
migrants are only a small fraction of Maine’s population: 3.5 percent of Mainers are foreign-born;https://www.pressherald.com/2016/09/22/business-groups-report-says-maine-needs-to-bring-in-more-immigrants/;United States;38.0;-97.0;-0.125;negative
asylum seekers that are coming to the border.;http://www.newsweek.com/trump-zero-tolerance-immigration-policy-judges-asylum-seekers-992055;Mexico;23.0;-102.0;0.0;neutral
migrants does not rest on the defense of open borders.;https://www.newyorker.com/news/our-columnists/trumps-opponents-arent-arguing-for-open-bordersbut-maybe-they-should;Honduras;15.0;-86.5;0.0;neutral
Refugee Day is observed on June 20 around the world, in order to commemorate the strength, courage and perseverance of millions of refugees.;https://www.thenews.com.pk/magazine/instep-today/332339-fnkasia-and-unhcr-pakistan-join-hands-to-promote-refugee-artisans;Pakistan;30.0;70.0;0.0;neutral
migrants are breaking the law despite having the ability to seek refugee status through legal means.;https://www.therebel.media/detainment_of_illegal_aliens_isn_t_america_s_fault;United States;38.0;-97.0;0.2;positive
refugees is now almost double what it was at the start of 2017 and is expected to continue rising.;http://allafrica.com/stories/201806220339.html;South Sudan;15.0;30.0;-0.05;negative
migrants are so important that she considers this march the most important action of Pride Weekend, even though it it takes place in the shadows of Pride.;https://missionlocal.org/2018/06/as-pride-weekend-takes-over-the-city-transgender-activists-are-focusing-on-violence-at-the-border/;United States;38.0;-97.0;0.35;positive
refugee policy is under increasing pressure due to the scale of the crisis, and services are “overstretched while available land is dwindling”, the commission said.;http://www.publicfinanceinternational.org/news/2018/06/eu-pledges-eu34m-help-refugees-uganda-and-kenya;Kenya;1.0;38.0;0.138;positive
migrants are living in one French suburb… ANDREW MALONE explores the tensions in a community at odds with mainstream society Andrew Malone ventured into the Paris suburb of Saint-Denis for a week;https://www.anti-semitism.net/page/4;French Southern Territories;-43.0;67.0;0.0;neutral
migrants is only a fraction of the lost.;https://www.dailyrecord.co.uk/news/uk-world-news/donald-trumps-zero-tolerance-policy-12762912;Germany;51.0;9.0;0.0;neutral
refugee Elmer is reunited with his two children, Eddy, 17, and Lilian, nine, at Logan international airport.;https://www.theguardian.com/us-news/2018/jun/22/going-through-hell-at-the-border-parents-split-from-children-tell-of-anguish;United States;38.0;-97.0;0.0;neutral
migrants are arriving, European Commissioner Guenther Oettinger has said.;https://www.rte.ie/news/world/2018/0622/972358-migrant-summit/;Germany;51.0;9.0;0.0;neutral
refugees is inherently a humanitarian act, it is equally a measure of more nuanced foreign policy and national security objectives.;https://www.pennlive.com/news/2018/06/refugee_resettlement_worker_st.html;United States;38.0;-97.0;0.125;positive
