sentence;url;place;lat;lon;sentiment_score;sentiment
Refugees are the people who take their role against their will, chased out from their villages and towns by conflict or persecution and others move in search of safety,” he said.;http://thepoint.gm/africa/gambia/article/world-refugee-day-2018-observed-in-gambia;Gambia;13.47;-16.57;0.0;neutral
refugees are able to work without a permit.;http://www.refworld.org/docid/5b2cb8784.html;Qatar;25.5;51.25;0.5;positive
migrants is displayed in the background.;https://www.huffingtonpost.co.uk/entry/how-the-migration-crisis-has-brought-europe-to-the-brink-again_uk_5b2a688be4b0a4dc99230ba8;Malta;35.83;14.58;0.0;neutral
refugees are welcome in Lewisham.”;http://www.eastlondonlines.co.uk/2018/06/lewisham-council-to-take-in-over-100-refugee-families/;United Kingdom;54.0;-2.0;0.8;positive
migrant children are asking a federal judge to require the government to get a court order or parental permission before administering psychotropic medication;https://www.chron.com/news/houston-texas/houston/article/Lawyers-Require-permission-before-medicating-13015588.php;United States;38.0;-97.0;0.0;neutral
migrant families is planning to protest Friday.;https://www.thedenverchannel.com/news/local-news/boulder-group-to-protest-trump-s-immigration-policies;United States;38.0;-97.0;0.0;neutral
refugees who are arriving without permission.;http://montrealgazette.com/opinion/chris-selley-no-signs-of-the-liberals-getting-serious-about-border-crossing-asylum-seekers/wcm/6fba22a8-760f-44a6-9738-82b16b04caf7;Mexico;23.0;-102.0;0.0;neutral
migrants are held – out of sight and largely out of mind, often for years – on nearby Nauru and Papua New Guinea.;http://www.newtimes.co.rw/opinions/confronting-migrant-threat-eu;Papua New Guinea;-6.0;147.0;0.175;positive
migrant groups are represented in the parliament, as are many women.;http://www.refworld.org/docid/5b2cb8434.html;Sweden;62.0;15.0;0.5;positive
Refugee Week is marked around the world.;https://www.christianheadlines.com/blog/un-chief-personally-concerned-about-return-of-christians-to-iraq-and-syria.html;Myanmar;22.0;98.0;0.1;positive
migrants are treated in Britain.;http://theconversation.com/from-world-war-ii-enemy-internment-to-windrush-britain-quickly-forgets-its-gratitude-to-economic-migrants-98331;United Kingdom;54.0;-2.0;0.0;neutral
refugees are now stranded around the world, facing fates similar to that of Alan Kurdi.;https://www.dhakatribune.com/opinion/op-ed/2018/06/22/of-moral-misconducts-and-golden-victories;Kazakhstan;48.0;68.0;0.0;neutral
refugees maintain is hope.;https://www.thecourier.co.uk/fp/news/local/dundee/674478/dundee-researchers-work-with-child-refugees/;Iraq;33.0;44.0;0.0;neutral
refugee camp is considered closed when last alien leaves either on repatriation or is moved to another camp.;http://www.kbc.co.ke/unhcr-hand-dadaab-assets-government/;Kenya;1.0;38.0;-0.117;negative
refugee camps is neither attractive nor palatable.;http://allafrica.com/stories/201806220141.html;Nigeria;10.0;8.0;0.8;positive
migrant workers are also vulnerable to forced labor abroad in a variety of industries.;http://www.refworld.org/docid/5b2cb83326.html;Vietnam;16.0;106.0;-0.4;negative
migrants are being treated both on the border with Mexico and in Massachusetts.;https://www.redstate.com/alexparker/2018/06/21/media-use-term-illegal/;Mexico;23.0;-102.0;0.0;neutral
migrants are applying for asylum in the European country in which they arrive—countries like Greece or Italy—and are then moving on to wealthier Germany;http://www.newsweek.com/can-angela-merkel-survive-hungarys-far-right-president-sabotages-europes-plan-991085;Greece;39.0;22.0;0.0;neutral
refugees is common across Europe.;https://www.courthousenews.com/border-crises-spring-up-across-strained-eu/;Italy;42.83;12.83;-0.3;negative
refugees are coming across the border without guardians;http://www.speroforum.com/a/TNIBZODEKN1/83557-Feds-give-500-million-to-nonprofit-housing-illegal-alien-minors;Mexico;23.0;-102.0;0.0;neutral
migrants are not much different from those of the past.;https://www.htrnews.com/story/opinion/2018/06/21/family-separation-immigration-policy-donald-trump/723283002/;United States;38.0;-97.0;-0.125;negative
asylum seekers are from Syria – 17,585, Iraq – 6,900 and Niger – 4,794.;http://georgiatoday.ge/news/10904/Fewer-Georgians-Sought-Asylum-in-Germany-Last-Month;Iraq;33.0;44.0;0.0;neutral
refugees are mainly from DRC, Burundi, Rwanda, Mozambique and the Horn of Africa.;http://allafrica.com/stories/201806220827.html;Central African Republic;7.0;21.0;0.167;positive
refugees which is about putting yourself in the shoes of other people.”;https://www.fifetoday.co.uk/whats-on/the-outlander-bard-with-a-song-in-his-heart-to-pay-visit-to-fife-1-4758385;Germany;51.0;9.0;-0.125;negative
migrants are human beings.;https://www.americamagazine.org/politics-society/2018/06/21/open-letter-ice-former-law-enforcement-officer;United Kingdom;54.0;-2.0;0.0;neutral
Migrants are seen on the deck of the Mission Lifeline rescue boat in the central Mediterranean Sea, June 21, 2018.;https://uk.reuters.com/article/uk-europe-migrants-italy/italy-asks-malta-to-take-in-seize-migrant-rescue-ship-idUKKBN1JI1FY;Germany;51.0;9.0;0.0;neutral
