sentence;url;place;lat;lon;sentiment_score;sentiment
migrants who are seeking asylum must present themselves.;http://addisonindependent.com/201806welch-sees-kids-fenced-border;Mexico;23.0;-102.0;0.0;neutral
migrant children are being processed and held at the U.S. Customs and Border Protection Nogales Placement Center in Nogales;https://www.msn.com/en-us/travel/article/fate-of-immigrant-children-separated-from-parents-is-unclear/ar-AAyZxjK;United States;38.0;-97.0;-0.1;negative
asylum seekers are separated from their children, even though it is only done in unusual cases.;https://www.newsbusters.org/blogs/nb/brad-wilmouth/2018/06/22/cnns-cuomo-brags-about-only-75-illegals-showing-court;North Korea;40.0;127.0;0.1;positive
migrant children are routinely and forcibly given a range of psychotropic drugs at U.S. government-funded youth shelters to manage their trauma after being detained and in some cases separated from parents;http://english.republika.mk/u-s-shelters-force-migrant-children-to-take-drugs/;United States;38.0;-97.0;0.5;positive
Asylum seekers are not a “burden” for European economies: Study;http://www.homelandsecuritynewswire.com/dr20180622-asylum-seekers-are-not-a-burden-for-european-economies-study;Norway;62.0;10.0;0.0;neutral
migrants are thrown in prisons to face torture and other abuse.;http://www.dailymail.co.uk/news/article-5871979/Pope-Countries-migrants-can.html;Tunisia;34.0;9.0;-0.125;negative
refugees who are barred from applying to nearly 100 professions under Lebanese law, as well as the daily inconvenience of checkpoints.;https://www.scribd.com/article/382358385/Swedish-Walk-To-Palestine-Activist-Visits-Refugee-Camps-In-Lebanon;United States;38.0;-97.0;0.05;positive
Refugees are vulnerable to a spectrum of abuses, exposing refugees and migrants to a variety of human rights violations, violence, famine, and lack of opportunities.;https://reliefweb.int/report/world/collaboration-and-connectivity-are-keys-refugee-response;Norway;62.0;10.0;-0.25;negative
migrant evangelicals are worshipping alongside immigrants, those relationships rebut some of the negative stereotypes and fears,” Soerens said.;http://www.ncregister.com/daily-news/latest-immigration-controversy-points-to-possible-political-shift-amon;United States;38.0;-97.0;-0.3;negative
migrants are reported to have drowned off Libya in two days, bringing to at least 1,000 the number to die this year on the main migratory route linking Africa and Europe, the UN said Thursday.;https://www.middle-east-online.com/en/over-1000-migrants-drowned-mediterranean-2018;Central African Republic;7.0;21.0;-0.078;negative
migrants is so blurred that we will have to tighten the definition of ‘refugee.;https://www.theaustralian.com.au/news/world/the-times?nk=2d80a79aa05f728176ef5c4fab43f3a8-1529646391;United States;38.0;-97.0;0.0;neutral
Refugee Resettlement is in charge of housing the thousands of migrant children separated from their families.;http://sacramento.cbslocal.com/2018/06/21/california-prepares-lawsuit-over-family-separation-policy/;United States;38.0;-97.0;0.0;neutral
refugees are referred to CSS’s immigration legal services to obtain permanent authorization to live and work in the U.S.;http://catholicphilly.com/2018/06/news/local-news/thank-you-for-saving-us-refugees-start-new-life-with-catholics-help/;Malawi;-13.5;34.0;0.168;positive
Refugee Resettlement, is much closer to home in Woodland.;http://sacramento.cbslocal.com/2018/06/22/legal-complaints-undocumented-minors/;United States;38.0;-97.0;0.2;positive
refugees are now unevenly distributed across the EU.;https://yle.fi/uutiset/osasto/news/finnish_interior_minister_proposes_ten-fold_increase_in_quota_refugees_across_the_eu/10270394;Italy;42.83;12.83;-0.2;negative
migrants does not mean much to Central American families crossing Mexico, who say they are more afraid of violence and poverty at home.;https://news.mb.com.ph/2018/06/22/migrants-fear-violence-poverty-more-than-trump/;Central African Republic;7.0;21.0;0.011;positive
Refugee Day is observed June 20 each year and is dedicated to raising awareness of the situation of refugees throughout the world.;https://awoko.org/2018/06/22/sierra-leone-news-today-is-world-refugee-day/;Guinea;11.0;-10.0;0.0;neutral
migrants who are desperate to make bail.;http://www.wbur.org/npr/622527131/mother-and-son-reunite-at-airport-u-s-had-split-them-because-of-migrant-status;United States;38.0;-97.0;-0.6;negative
migrants are illegally worked at $1/hr for 10 hrs/day for giant corporations, the Sheridan detention center, and all other detention centers around the country.;https://www.liberationnews.org/portland-workers-and-students-occupy-immigration-and-customs-enforcement-detention-center-demanding-ice-abolition/;United States;38.0;-97.0;-0.181;negative
migrant children are shown walking in single file between tents in their compound next to the Mexican border in Tornillo, Texas on June 18;http://www.dailymail.co.uk/news/article-5875613/Rachel-Campos-Duffy-claims-black-friends-say-detention-centers-better-projects.html;United States;38.0;-97.0;-0.024;negative
migrant children—who are reportedly being held in cages at government facilities—were separated from their parents at the U.S.-Mexico border between April 19 and May 31 of this year.;https://www.harpersbazaar.com/beauty/makeup/a21762517/profits-from-liquid-lipstick-help-rejoin-migrant-families/;United States;38.0;-97.0;0.0;neutral
refugee crisis is occurring not because of the number of refugees but because Europe has failed to respond to it in a coordinated fashion.;https://face2faceafrica.com/article/how-europe-is-turning-its-back-on-africans-who-are-dying-in-the-mediterranean;Iran;32.0;53.0;-0.5;negative
refugees is a core part of what the nation is well-known for doing over the past years.;http://allafrica.com/stories/201806220174.html;Namibia;-22.0;17.0;-0.25;negative
migrant parents are supposed to call if they want information about their children.;http://www.krdo.com/news/politics/chaos-as-migrant-parents-search-for-children/756950300;United States;38.0;-97.0;0.0;neutral
migrants are warehoused in prison-like conditions.“In many Texas facilities;https://www.sacurrent.com/the-daily/archives/2018/06/22/study-documents-abuse-at-immigrant-detention-facilities-where-families-are-separated;Mexico;23.0;-102.0;0.5;positive
migrants are seen by many as criminals if the insulting messages sent to the passengers of the Aquarius by European citizens are anything to go by.;http://allafrica.com/stories/201806220446.html;Vietnam;16.0;106.0;-0.167;negative
Refugees are a thing that is close to my heart and I just wanted to actually do something,” Ms Turale said.;https://www.examiner.com.au/story/5481676/launceston-trio-attempt-to-live-on-refugee-rations-for-one-week/;Syria;35.0;38.0;0.0;neutral
refugees is set to begin on Monday.;http://www.scmp.com/news/hong-kong/hong-kong-law-and-crime/article/2152085/canada-has-been-dragging-its-feet-human;Philippines;13.0;122.0;0.0;neutral
migrant children is a new administrative gem.;http://aldianews.com/articles/politics/immigration/economic-machinery-behind-immigration-detention-centers/53108;United States;38.0;-97.0;0.136;positive
Migrants are “trying to find new paths to get to European Union countries” after nations along the route up from Turkey and Greece significantly increased their border security;http://www.taipeitimes.com/News/world/archives/2018/06/23/2003695406;Turkey;39.0;35.0;0.17;positive
migrant children are, in fact, related to their parents.;https://reason.com/archives/2018/06/22/trump-is-using-the-border-crisis-to-stok;United States;38.0;-97.0;0.0;neutral
refugees who are fleeing war and hunger” as well as persecution, Francis said.;http://mynorthwest.com/1026110/pope-countries-should-take-in-as-many-migrants-as-they-can/;Canada;60.0;-95.0;0.0;neutral
"refugees are now in all neighbouring countries and of course in Turkey, and in Greece and across Europe.""";http://www.middleeasteye.net/news/corbyn-says-uk-should-more-while-refugee-tour-jordan-761445504;Turkey;39.0;35.0;0.0;neutral
refugees problem is a shared responsibility.;https://www.the-star.co.ke/news/2018/06/22/un-seeks-to-mitigate-environmental-degradation-by-refugees-in-dadaab_c1776053;Kenya;1.0;38.0;0.0;neutral
refugees are hard-working taxpayers with many starting businesses and becoming homeowners.;http://www.sanluisobispo.com/opinion/readers-opinion/article213628179.html;United States;38.0;-97.0;0.317;positive
migrants are stranded in or near the frontlines.;http://www.4-traders.com/news/UNOG-United-Nations-Office-at-Geneva-REGULAR-PRESS-BRIEFING-BY-THE-INFORMATION-SERVICE--26813106/;Qatar;25.5;51.25;0.1;positive
asylum seekers who are not of ethnic Armenian origin.;http://www.refworld.org/docid/5b2cb8844.html;Russia;60.0;100.0;0.0;neutral
migrant families is spurring people in Central Ohio to action.;http://abc6onyourside.com/news/local/central-ohio-organizations-helping-immigrants-seeking-asylum;United States;38.0;-97.0;0.05;positive
refugee crisis is now well understood.;https://www.fairborndailyherald.com/opinion/28494/our-dismal-water-future-mapped;Greenland;72.0;-40.0;0.0;neutral
migrant plan is therefore two-fold;https://www.zerohedge.com/news/2018-06-22/trump-might-rescue-italy-migrant-crisis-order-divide-europe;Italy;42.83;12.83;0.0;neutral
migrant strategy is urgently needed, but where it will come from, remains unclear.;http://www.newsweek.com/how-rich-could-help-solve-migrant-crisis-opinion-990645;United Arab Emirates;24.0;54.0;0.0;neutral
refugees who are fleeing war and hunger” as well as persecution,;https://www.sltrib.com/news/nation-world/2018/06/21/countries-should-take-in-as-many-refugees-as-they-can-pope-francis-says/;Italy;42.83;12.83;0.0;neutral
refugees are becoming more common place, and with the acceleration of global warming, the impact of these crises will be even more detrimental.”;http://www.homelandsecuritynewswire.com/dr20180622-the-lessons-of-natural-disasters-for-the-world;Australia;-27.0;133.0;0.23;positive
"asylum seekers is ""obviously already better than the American system"" but acknowledged it could be improved.";https://www.msn.com/en-ca/news/canada/canada-aims-to-curb-number-of-migrant-children-held-in-detention/ar-AAyYoLK;Mexico;23.0;-102.0;0.167;positive
asylum seeker is a human being, deserving of compassion, empathy and dignity.;https://www.barbadosadvocate.com/columns/editorial-176;Germany;51.0;9.0;0.3;positive
migrants are our neighbors, and the Bible is pretty clear about what to do for our neighbors.”;https://www.westsiderag.com/2018/06/22/mother-from-guatemala-takes-refuge-in-uws-church-to-avoid-deportation;United States;38.0;-97.0;0.175;positive
migrants is stirring debate throughout the union.;https://thefrontierpost.com/concept-of-migrant-centres-outside-of-eu-stirs-debates/;Germany;51.0;9.0;0.0;neutral
asylum seekers are being held.;https://gizmodo.com/journalists-start-using-drones-to-view-immigrant-detent-1827044608;United States;38.0;-97.0;0.0;neutral
Asylum seekers are being passed along as pawns in a political game.;https://www.euractiv.com/section/justice-home-affairs/opinion/if-we-fail-to-reform-the-dublin-regulation-everybody-loses-especially-children/;Germany;51.0;9.0;-0.2;negative
Refugee Agency, is mandated by the United Nations to lead and coordinate international action for the worldwide protection of refugees and the resolution of refugee problems.;https://www.afi-global.org/blog/2018/06/advancing-financial-inclusion-refugees-through-inclusive-market-system-approach;United States;38.0;-97.0;0.05;positive
asylum seekers must not be carried out at the expense of people in maritime distress,” Bayer added.;http://elliderusa.com/migrant-ship-aquarius-reveals-fractured-europe/;Germany;51.0;9.0;0.0;neutral
refugees is still ahead of us,” he added.;https://www.lbcgroup.tv/news/lebanon-news/385926/merkel-wraps-up-official-visit-by-meeting-aoun/en;Germany;51.0;9.0;0.0;neutral
refugees are being turned away from Italy the question of immigrants’ humanity has yet to be politically settled) it explains why health would be a sector that favours migration.;https://www.theguardian.com/commentisfree/2018/jun/22/honour-nhs-built-on-immigration-windrush;Italy;42.83;12.83;0.0;neutral
Refugee Resettlement is seeking to place the children in temporary foster homes, while the Pentagon assesses how it might house as many as 20,000 unaccompanied migrant children on military bases.;https://www.villagevoice.com/2018/06/22/new-yorkers-fight-to-aid-child-victims-of-trumps-family-separation-policy/;United States;38.0;-97.0;0.2;positive
migrant minors are currently housed there.;https://www.texastribune.org/2018/06/21/immigrant-children-tent-city-texas-mayors-austin-el-paso/;United States;38.0;-97.0;0.0;neutral
"refugees are welcome here and we must do what we can to support them.""";https://www.beijingbulletin.com/news/257536850/local-volunteers-needed-to-welcome-refugees-in-the-city;China;35.0;105.0;0.8;positive
migrant families, are appalling.;http://www.johnsoncitypress.com/Letter-to-the-Editor/2018/06/22/Letters-13.html;United States;38.0;-97.0;-0.35;negative
migrants are have come to the American border seeking asylum under U.S. law, which they have the right to do.;https://www.nbcnews.com/think/opinion/trump-s-executive-order-ended-family-separations-legal-challenges-remain-ncna885491?cid=public-rss_20180622;United States;38.0;-97.0;0.143;positive
asylum seekers are criminals.;http://rollonfriday.com/MainDiscussion/tabid/381/id/11897674/Default.aspx;Germany;51.0;9.0;0.0;neutral
migrants are women and children from countries in Central America including, Guatemala, Honduras and El Salvador.;https://www.usatoday.com/story/news/politics/2018/06/21/reunification-immigrant-children-uncertain-court-cases-continue/723821002/;Guatemala;15.5;-90.25;0.0;neutral
refugee is beaten to death by hammer-wielding youth.;https://www.anti-semitism.net/category/hush-crimes;United States;38.0;-97.0;0.0;neutral
migrants who are here legally;http://www.citywatchla.com/index.php/los-angeles/15672-the-most-cruel-policy-of-all-conflating-feelings-with-our-current-border-and-homeless-enforcement;Mexico;23.0;-102.0;0.2;positive
refugees are cultural differences.;https://www.euractiv.com/section/global-europe/news/lebanons-never-ending-refugee-story/;Lebanon;33.83;35.83;0.1;positive
Refugee Resettlement is turning its back on the children for whom they are responsible.”;https://www.newyorker.com/news/news-desk/the-office-of-refugee-resettlement-is-completely-unprepared-for-the-thousands-of-immigrant-children-now-in-its-care;United States;38.0;-97.0;0.1;positive
migrant children are a low priority for deportation.;https://www.rollingstone.com/politics/news/family-separation-explained-w521891;Honduras;15.0;-86.5;0.0;neutral
asylum seekers are illegally turned away at ports of entry, Ferguson said.;https://www.sfgate.com/news/bayarea/article/Executive-Order-Prompts-U-S-Bid-To-Modify-13016133.php;United States;38.0;-97.0;-0.5;negative
refugee community is an invisible and marginalised group.;https://www.gaystarnews.com/article/lgbti-refugees-face-violence-discrimination-and-we-need-to-help-them/;United Kingdom;54.0;-2.0;0.0;neutral
migrants are now more assimilated;https://www.sltrib.com/opinion/commentary/2018/06/22/catherine-rampell-the-real-hoax-about-the-border-crisis/;United States;38.0;-97.0;0.5;positive
migrants did not enter illegally, their status as refugee claimants is legal, they are documented and their movement in Canada is tracked by border officials.;http://rabble.ca/blogs/bloggers/policyfix/2018/06/winnipegs-undocumented-case-access-without-fear;Canada;60.0;-95.0;-0.15;negative
migrant Aregai is already in Italy when the filmmakers begin telling his harrowing story.;http://www.watertowndailytimes.com/curr/hbos-it-will-be-chaos-personal-stories-of-refugee-crisis-could-not-be-timelier-20180622;Italy;42.83;12.83;0.0;neutral
refugees There are refugee services in 58 different UK cities.;https://www.walesonline.co.uk/news/local-news/eritrea-asylum-wales-newport-meal-14810505;United Kingdom;54.0;-2.0;0.0;neutral
migrants are kept for over 72 hours has posters with phone numbers and emails parents can use to try to and locate their children.;https://www.huffingtonpost.com/entry/process-reunite-immigrant-children-families-chaos_us_5b2c4b4ae4b0321a01cf80b5;United States;38.0;-97.0;0.0;neutral
migrant children is a winning issue.;http://www.timesheraldonline.com/opinion/20180622/gene-lyons-presidents-bullying-takes-on-easy-target-immigrant-children;Mexico;23.0;-102.0;0.5;positive
migrant children are a start.;https://www.greenleft.org.au/content/how-can-trumps-cruelty-be-stopped;China;35.0;105.0;0.0;neutral
migrant families are housed defies any sense of logic and human decency,” Gov.;http://www.westmilfordmessenger.com/apps/pbcs.dll/article?AID=/20180620/NEWS01/180629997/0/FUNANDGAMES04/Updated:-President-Trump-signs-order-to-end-policy;United States;38.0;-97.0;0.0;neutral
refugees are responsible for the country’s ills and wants to send them back, her rhetoric excites parts of the base of the Nationalist Movement Party (MHP), which has formed an alliance with Erdoğan.;http://www.nybooks.com/daily/2018/06/22/will-turkeys-voters-give-erdogan-the-imperial-presidency-he-seeks/;Turkey;39.0;35.0;-0.1;negative
refugees are experiencing an increased hostility and pressure to leave Lebanon from certain politicians and municipal police.;https://www.independent.co.uk/news/world/syria-refugees-photos-latest-lebanon-camps-women-children-immigrants-civil-war-a8406256.html;Lebanon;33.83;35.83;0.214;positive
refugees are granted the right to work in addition to the government has a policy of progressively integrating refugees into national systems for health and education.;http://www.newtimes.co.rw/opinions/when-tedx-brought-home-refugee-message;South Sudan;15.0;30.0;0.286;positive
refugee is someone who has been forced to flee his or her home because of war, violence or persecution, often without warning.;https://www.rescue.org/article/refugees-asylum-seekers-immigrants-and-migrants-whats-difference;Honduras;15.0;-86.5;-0.3;negative
migrants is concentrated in southern Maine.;https://www.pressherald.com/2017/02/21/report-foreign-born-workers-needed-in-maine/;United States;38.0;-97.0;0.0;neutral
migrants are being deported and detained in record numbers, and police militarization, in general, is high.;https://www.dailydot.com/debug/amazon-workers-protesting-ethics/;United States;38.0;-97.0;0.105;positive
Refugee Week is ‘I Stand With Refugees’.;https://www.naracoorteherald.com.au/story/5484536/migrant-resource-centre-hosts-refugee-week-community-lunch/?cs=1866;Australia;-27.0;133.0;0.0;neutral
asylum seekers are detained in prisons.;https://www.sott.net/article/388863-Trudeau-criticizes-Trump-over-illegal-immigration-while-Canada-keeps-illegal-immigrant-children-in-prison-and-under-surveillance;United States;38.0;-97.0;0.0;neutral
refugees are resettled in Iceland;http://www.refworld.org/docid/5b2cb86a3.html;Iceland;65.0;-18.0;0.0;neutral
migrants they are held in detention camps that evoke the worst conditions of camps in the Second World War.;http://www.thetablet.co.uk/news/9285/pope-activities-of-human-traffickers-worldwide-concern;Canada;60.0;-95.0;-0.5;negative
refugees is in our community and how we create a space where we can continue to be a welcoming community;https://www.boiseweekly.com/boise/ahead-of-world-refugee-day-city-touts-new-study-on-immigrants-economic-contributions-to-ada-county/Content?oid=12104002;United States;38.0;-97.0;0.0;neutral
migrant community is nothing new.;http://katu.com/news/local/local-latino-community-reacts-to-immigration-controversy;Japan;36.0;138.0;0.136;positive
asylum seekers are asked during a credible fear interview;http://news.wjct.org/post/how-us-asylum-system-works;United States;38.0;-97.0;0.4;positive
migrants who are seeking asylum end up being prosecuted for illegal border crossings.;http://www.koaa.com/story/38487289/keeping-families-together-rally-planned-in-colorado-springs;Mexico;23.0;-102.0;-0.5;negative
refugee who is in detention and being deported needs a lawyer;http://abc7news.com/society/bay-area-activists-mobilize-to-help-immigrant-families/3634190/;United States;38.0;-97.0;0.0;neutral
migrants are exposed to in transit and destination countries, drawing examples from various regions of the world.;https://www.thedailystar.net/world/act-now-protect-migrants-vulnerable-trafficking-exploitation-un-1593772;Switzerland;47.0;8.0;0.0;neutral
migrants are applying for asylum in the European country where they arrive—countries like Greece or Italy—and are then moving on to wealthier Germany where they can live better and more comfortably.;https://www.msn.com/en-us/news/world/can-merkel-survive-hungarys-leader-stirs-trouble/ar-AAz1hq4;Greece;39.0;22.0;0.307;positive
migrants are disproportionately people of color,” meaning any enforcement “will have a disparate impact on racial minorities.”;https://nypost.com/2018/06/22/time-for-dems-to-give-trump-his-wall-and-other-commentary/;United States;38.0;-97.0;0.0;neutral
refugees are living in the country.;http://www.xinhuanet.com/english/2018-06/22/c_137274063.htm;Pakistan;30.0;70.0;0.0;neutral
migrants are the victims, and Cabrera clarifies that crossing the Rio Grande is illegal for both U.S. citizens and immigrants.;https://whatdidyousay.org/2018/06/21/watch-border-agent-expertly-flips-script-on-cnn-leaves-host-speechless/;Puerto Rico;18.25;-66.5;-0.5;negative
migrants are escorted back across the border by US Customs and Border Patrol agents Credit: David J Phillip/AP;http://www.itv.com/news/2018-06-22/confusion-swirls-on-border-after-trump-u-turn-on-migrant-families/;United States;38.0;-97.0;0.0;neutral
refugees are fleeing.;http://www.thenational.scot/community/16307017.Letters__If_we_want_to_rattle_Trump__let_s_just_ignore_him/;United States;38.0;-97.0;0.0;neutral
migrant families is part of a broader strategy to “deter” asylum seekers.;https://truthout.org/articles/the-republican-war-on-the-poor-and-vulnerable/;Mexico;23.0;-102.0;0.0;neutral
migrant children are kept and observed the care in a room of about 15 children.;https://www.medpagetoday.com/pediatrics/generalpediatrics/73634;United States;38.0;-97.0;0.0;neutral
migrants who are almost always already here in temporary worker visas.;https://www.cato.org/blog/house-gop-bill-cuts-legal-immigration-14-million-over-20-years;United States;38.0;-97.0;0.0;neutral
migrant community is taking a lot of risks but not just Latinos its immigrants of all nationalities.”;https://www.episcopalchurch.org/library/article/interfaith-voices-demanding-changes-immigration-policy-make-difference-washington;United States;38.0;-97.0;0.0;neutral
migrants we are prepared to welcome each year, with refugees at highest priority.;https://sojo.net/articles/families-torn-apart-lightning-flash-reveals-our-hidden-cruelties;United States;38.0;-97.0;0.8;positive
refugee crisis is actually closer to home than many people think.;http://priceofoil.org/2018/06/22/is-separating-families-at-us-border-the-beginning-of-climate-apartheid/;Mexico;23.0;-102.0;0.25;positive
migrants are more inclined to help one another as they wait and hope to escape from dire straits.;https://www.theguardian.com/us-news/live/2018/jun/22/trump-family-separation-crisis-immigration-border;Mexico;23.0;-102.0;0.5;positive
"refugees who are fleeing war and hunger"" as well as persecution, Francis said.";http://www.baynews9.com/fl/tampa/ap-online/2018/06/21/pope-countries-should-take-in-as-many-migrants-as-they-can;Canada;60.0;-95.0;0.0;neutral
asylum seekers are taken into custody by U.S. Border Patrol agents on June 12, 2018 near McAllen, Texas.;https://www.aol.com/article/news/2018/06/22/pentagon-to-house-20000-migrant-children-on-military-bases/23465804/;United States;38.0;-97.0;0.1;positive
migrant children are being cared for by the New York organization.;https://www.publicintegrity.org/2018/06/22/21879/michigan-official-says-migrant-kids-sent-across-country-without-sure-way-find;United States;38.0;-97.0;0.136;positive
refugees are fleeing situations of identity-based violence and atrocity.;https://www.huffingtonpost.co.uk/entry/as-tensions-escalate-in-kachin-why-is-the-uk-not-doing_uk_5b2bce76e4b00b9b51c42119;Myanmar;22.0;98.0;0.0;neutral
Refugee advocates are asking the federal government to suspend it’s Safe Third Country Agreement with the United States because the U.S. is clearly no longer a safe haven under Trump.;https://ipolitics.ca/2018/06/22/morning-brief-building-bridges-and-suspending-agreements/;United States;38.0;-97.0;0.237;positive
Refugee Day is so important.;http://justmeans.com/blog/on-world-refugee-day-an-opportunity-to-change-the-narrative;Greece;39.0;22.0;0.4;positive
migrant children are kept.;https://www.goodhousekeeping.com/life/a21775845/ibis-obeida-guzman-colindres-immigrant-mother-separated-child-interview/;Mexico;23.0;-102.0;0.0;neutral
migrants do not increase local crime rates and that they are less likely to cause crime and less likely to be incarcerated than their native-born peers.”;https://www.tcpalm.com/story/opinion/columnists/bob-gabordi/2018/06/22/womp-womp-corey-lewandowski-mocking-special-needs-kids/725542002/;Mexico;23.0;-102.0;-0.067;negative
asylum seekers are way down, the long crisis still threatens one of the European Union’s greatest accomplishments, the “border-free” Schengen zone.;https://www.nytimes.com/2018/06/22/world/europe/migration-europe-merkel-seehofer-germany.html;Germany;51.0;9.0;0.199;positive
migrant detention is still far too common around the globe.;http://pacific.scoop.co.nz/2018/06/anzasw-statement-on-separating-detaining-migrant-families/;Nauru;-0.53;166.92;-0.1;negative
