sentence;url;place;lat;lon;sentiment_score;sentiment
refugees are facing life-threatening rains and disease as monsoon rains continue to lash the camps in Cox’s Bazar, Bangladesh.;https://livenews.co.nz/2018/06/19/race-against-time-for-rohingya-refugees-as-monsoon-rains-flooding-and-landslides-continue/;Bangladesh;24.0;90.0;0.0;neutral
migrant children are being separated from their parents under a zero-tolerance policy.;http://nationalpost.com/pmn/news-pmn/the-latest-trump-gop-debate-immigration-fix;United States;38.0;-97.0;0.0;neutral
refugees are rarely greeted, let alone welcomed in, either by national representatives at the borders or by private citizens.;http://blogs.timesofisrael.com/we-are-og-turning-the-tables-on-world-refugee-day/;Hungary;47.0;20.0;0.15;positive
refugees that are in a long-lasting and intractable state of limbo for five years or more.;https://blog.esrc.ac.uk/2018/06/19/the-place-of-prosperity-in-protracted-refugee-crises/;Lebanon;33.83;35.83;0.5;positive
migrants are housed after a 24-year-old migrant from Morocco was killed in a fight on Saturday.;http://www.businessinsider.com/r-bosnian-police-prevent-hundreds-of-migrants-from-entering-croatia-2018-6;Morocco;32.0;-5.0;-0.2;negative
migrant arrests is rising.;https://blogs.spectator.co.uk/2018/06/on-germany-trump-is-right-about-the-big-picture-wrong-about-the-detail/;Ukraine;49.0;32.0;0.0;neutral
refugees are citizenship rights and an end to violence.;http://www.scoop.co.nz/stories/WO1806/S00096/un-mobilizes-in-rohingya-camps.htm;United States;38.0;-97.0;0.0;neutral
migrants is cruel and unlawful, Amnesty International said on Monday.;https://www.albawaba.com/news/israels-deportation-african-migrants-cruel-and-unlawful-amnesty-states-1146866;Rwanda;-2.0;30.0;-0.5;negative
migrant kids are seen outside at the C.B.P.;https://www.expressnews.com/news/local/article/At-a-border-immigration-shelter-a-room-of-13005394.php;Congo, The Democratic Republic of the;0.0;25.0;0.0;neutral
"refugees are in developing countries, many of them ""desperately poor"".";https://www.business-standard.com/article/pti-stories/record-68-5-mn-displaced-in-2017-un-refugee-agency-118061900893_1.html;Norway;62.0;10.0;0.05;positive
refugees are treated the world over.”;https://minnesota.cbslocal.com/2018/06/18/border-patrol-immigration-laws/;Mexico;23.0;-102.0;0.0;neutral
migrant children are separated from their parents as part of an increasingly criticized Trump administration policy.;https://www.insideedition.com/heartbreaking-audio-leaked-immigrant-child-separation-papa-papa-44286;United States;38.0;-97.0;0.0;neutral
migrants who are apprehended.But that forces the separation.;https://timesofindia.indiatimes.com/world/us/why-is-the-trump-administration-separating-immigrant-families/articleshow/64644418.cms;Mexico;23.0;-102.0;0.0;neutral
migrants are welcome here!” as they marched Tuesday in protest of policies they called “inhumane” that separate children from their parents.;https://www.elpasotimes.com/story/news/immigration/2018/06/19/el-paso-march-protests-trump-immigration-policy-separating-families/715657002/;United States;38.0;-97.0;0.05;positive
Refugee Resettlement is no longer legally responsible for the children once they were placed in a sponsor’s custody.;http://www.macon.com/news/nation-world/national/article213430099.html;United States;38.0;-97.0;0.2;positive
refugees are in developing countries, many of them “desperately poor.”;https://www.seattletimes.com/nation-world/apxun-refugee-agency-record-68-5-million-displaced-in-2017/;Switzerland;47.0;8.0;0.05;positive
migrants are coached to make an asylum claim, which in previous years would allow them to be released pending a hearing—a hearing which they may never attend, instead fading into the interior.;http://freebeacon.com/issues/feinstein-bill-lead-child-trafficking-gop-senator-says/;United States;38.0;-97.0;-0.167;negative
"migrants is ""arbitrary"" and vague, unduly threatens non-governmental organizations (NGOs) and violates European law.";https://www.yahoo.com/news/hungary-levy-tax-aid-groups-supporting-immigrants-125526015--business.html;Hungary;47.0;20.0;-0.2;negative
refugees is a must, said Salam.;https://www.thedailystar.net/rohingya-crisis/put-pressure-on-international-community-on-rohingya-repatriation-1592203;Bangladesh;24.0;90.0;0.0;neutral
migrants are being held 'in limbo' in a federal prison because other jails have insufficient space.;http://www.dailymail.co.uk/news/article-5860119/Oregon-senator-visits-federal-prison-illegal-immigrants-held.html;Mexico;23.0;-102.0;-0.125;negative
migrant fervor is of course Ann Coulter.;https://www.salon.com/2018/06/19/conservatives-anti-immigration-fervor-is-political-they-think-keeping-america-white-will-save-them/;United States;38.0;-97.0;0.0;neutral
migrants are trying to jump the queue of other would-be migrants to Europe.;http://www.scmp.com/comment/insight-opinion/article/2151421/migrants-who-arrived-europe-aboard-aquarius-are-not-refugees;Italy;42.83;12.83;-0.125;negative
migrants are not charged with any crime, they are not permitted to be jailed with their parents.;http://celebcafe.org/all-five-living-first-ladies-condemn-u-s-separation-policy-8817/;United States;38.0;-97.0;0.0;neutral
Migrant smuggling is a lucrative business, and cities have found a way to get rich off of Africa’s primary migrant routes.;http://en.people.cn/n3/2018/0619/c90000-9472504.html;Central African Republic;7.0;21.0;0.388;positive
migrants are being held.;https://wsvn.com/news/politics/wasserman-schultz-representatives-discuss-us-immigration/;United States;38.0;-97.0;0.0;neutral
refugees are living in low and middle-income countries like Lebanon, Pakistan and Uganda, Grandi said.;https://www.shine.cn/archive/world/UN-Record-685m-forced-to-flee-homes-worldwide/shdaily.shtml;Pakistan;30.0;70.0;0.0;neutral
asylum seekers are considered traitors in Eritrea, according to the Associated Press.;https://mic.com/articles/189873/immigrants-suicide-while-in-ice-custody-raises-questions-about-mental-health-care-of-detainees;Eritrea;15.0;39.0;0.0;neutral
migrants are shown outside a former Job Corps site that now houses them;http://www.cpr.org/news/story/bipartisan-group-of-former-us-attorneys-current-ags-condemn-trump-immigration-policy-on;United States;38.0;-97.0;0.0;neutral
migrants are now under suspicion of ‘criminal’ offenses, Customs and Border Patrol agents then separate the children from the parents.;https://ohnotheydidnt.livejournal.com/111281440.html;United States;38.0;-97.0;-0.4;negative
migrants are allowed to work and live in the US in the meantime, putting down roots.;http://sanfrancisco.cbslocal.com/2018/06/19/fact-checking-trump-on-immigration-family-separations/;Mexico;23.0;-102.0;-0.01;negative
refugee crisis is in our backyard.;https://www.kcet.org/shows/socal-connected/a-primer-on-refugees-and-asylum-seekers-and-why-theyre-not-illegal-immigrants;Germany;51.0;9.0;0.0;neutral
asylum seekers are in a prison, the Bureau of Prisons regulations apply for visits but “ICE is currently … working to ensure that detainees have appropriate access to their legal representatives.”;https://www.seattletimes.com/nation-world/apxprotesters-on-round-the-clock-vigil-at-oregon-ice-facility/;United States;38.0;-97.0;0.233;positive
"refugees is ""weeks away from painful cuts"" to its emergency assistance for Gaza and refugees elsewhere because of an unprecedented $250 million gap in its budget.";https://www.ynetnews.com/articles/0,7340,L-5291729,00.html;Israel;31.5;34.75;-0.05;negative
"refugees are in developing countries, many of them ""desperately poor.”";http://www.thestandard.com.hk/breaking-news.php?id=109157;South Sudan;15.0;30.0;0.05;positive
migrant children are being treated.;http://www.enca.com/world/trump-says-he-wont-let-us-become-migrant-camp;Mexico;23.0;-102.0;0.0;neutral
asylum seekers are prevented or occur within three years of arrival, European security agencies should prioritize monitoring very recent arrivals whom they assess to present a risk.;https://www.heritage.org/terrorism/report/the-asylum-terror-nexus-how-europe-should-respond;Egypt;27.0;30.0;0.0;neutral
refugee camps are particularly vulnerable to human trafficking, physical and sexual abuse, and wild animal attacks, among other risks.;https://www.dhakatribune.com/bangladesh/2018/06/20/world-refugee-day-what-will-become-of-the-rohingya-children;Myanmar;22.0;98.0;-0.004;negative
refugees are camped out, and Jeju.;https://www.weeklystandard.com/ethan-epstein/jeju-south-korea-how-a-tiny-volcanic-island-has-become-home-to-hundreds-of-yemeni-refugees;Malaysia;2.5;112.5;0.0;neutral
migrants are often blamed for trying to obtain benefits to which they have no right or overstaying their welcome.;https://www.bloomberg.com/view/articles/2018-06-19/europe-and-the-u-s-could-make-migration-manageable;Germany;51.0;9.0;0.329;positive
refugee children are respected.;http://www.theindependentbd.com/post/154455;Myanmar;22.0;98.0;0.0;neutral
migrants are being routinely denied the right to file for asylum.;http://www.wsws.org/en/articles/2018/06/19/immi-j19.html;United States;38.0;-97.0;0.286;positive
refugees are treated the world over,” Dujarric said.;https://www.financialexpress.com/world-news/children-must-not-be-traumatised-by-being-separated-from-their-parents-un-chief-antonio-guterres/1212004/;Switzerland;47.0;8.0;0.0;neutral
migrant children are held as their parents face prosecution for crossing the border illegally.;https://www.yahoo.com/news/audio-reveals-apos-screams-children-001000709.html;United States;38.0;-97.0;-0.5;negative
migrant remarks are aimed at the conservative base of the party that elevated his candidacy and is dominant in red states and House districts, especially those with largely white populations.;https://www.outsidethebeltway.com/trump-wants-gop-to-make-his-immigration-policies-the-center-of-the-2018-campaign/;United States;38.0;-97.0;-0.2;negative
migrant children are being held in juvenile detention centers where they are kept in chain-link cages, sometimes with 20 or more to a cage, according to The Associated Press.;https://www.huffingtonpost.com/entry/family-separation-trump-republicans_us_5b28499be4b0f0b9e9a421f1;United States;38.0;-97.0;0.125;positive
migrant families are being separated at the border not because of Democrats and not because some law forces this result, as [President Donald] Trump insists.;http://www.abajournal.com/news/article/is_it_true_denying_family_separation_policy_is_orwellian_stuff_newspapers_f;United States;38.0;-97.0;0.0;neutral
"migrants are treated the world over.""";http://www.xinhuanet.com/english/2018-06/19/c_137264588.htm;Mexico;23.0;-102.0;0.0;neutral
refugee camps, not granting them citizenship, equal rights, etc.).;http://www.thewhig.com/2018/06/18/letters-to-the-editor-june-18;Egypt;27.0;30.0;0.0;neutral
refugee camp is not.”;https://www.project-syndicate.org/commentary/italys-threat-to-the-eu-by-michael-boskin-2018-06;Germany;51.0;9.0;0.0;neutral
refugees are women and children.;https://reliefweb.int/report/uganda/uganda-field-update-aiding-most-vulnerable-south-sudanese-refugees;French Southern Territories;-43.0;67.0;0.0;neutral
refugees are at risk from flooding and landslides, with around 24,000 of those considered at high risk.;http://oneworld.org/2018/06/18/rohingya-refugees-hit-by-monsoons-flooding-and-landslides/;Bangladesh;24.0;90.0;0.16;positive
refugees are supposed to apply for asylum in the first EU country they enter, though many push on to richer countries such as Germany.;https://www.bloomberg.com/news/articles/2018-06-19/europe-heads-for-immigration-clash-with-euro-plans-pushed-aside;Germany;51.0;9.0;0.25;positive
migrants are from Africa, including 450 men and 80 women, of which at least seven are pregnant, as well as 89 adolescents and 11 children under the age of 13, according to the Valencia authorities.;https://www.euractiv.com/section/future-eu/news/half-of-aquarius-migrants-seek-asylum-in-france/;Central African Republic;7.0;21.0;0.017;positive
migrant children are reunited with their parents;https://www.usatoday.com/story/news/politics/2018/06/19/how-immigrant-children-families-reunited-according-federal-government/716065002/;United States;38.0;-97.0;0.0;neutral
refugee families are desperately trying to cope with the inability to be reunited with their loved ones.;https://www.theskanner.com/news/newsbriefs/27056-unite-oregon-hosts-mourn-pray-love-and-take-action-june-20;United States;38.0;-97.0;0.05;positive
migrants are coming here and they have salaries and employment and we don't.;https://www.aljazeera.com/indepth/features/180619163302062.html;Malta;35.83;14.58;0.0;neutral
Refugee Day is Wednesday June 20) There are more people displaced by conflict, hunger or persecution than ever before, and New Zealanders want to help.;http://community.scoop.co.nz/2018/06/ngos-call-for-more-support-for-countries-hosting-refugees/;South Sudan;15.0;30.0;0.318;positive
refugee camps are in some of the five endemic sub-counties.;https://www.newvision.co.ug/new_vision/news/1479986/adjumani-health-limping-weight-refugees;Burundi;-3.5;30.0;0.0;neutral
asylum seekers who are already registered elsewhere.;https://www.thelocal.de/20180619/the-refugee-debate-just-how-open-are-germanys-borders;Germany;51.0;9.0;0.0;neutral
migrant children is coming from someplace else.;http://www.palisadeshudson.com/2018/06/the-desert-is-no-place-for-kids/;Mexico;23.0;-102.0;0.0;neutral
migrants is stagnating.;http://www.infomigrants.net/en/post/10022/european-media-react-to-german-asylum-rift;Mexico;23.0;-102.0;0.0;neutral
migrants are from African countries like Sudan and Nigeria, with others coming from Eritrea, South Sudan and Algeria.;https://www.infowars.com/spain-students-forced-out-of-their-homes-to-make-way-for-migrants/;South Sudan;15.0;30.0;0.0;neutral
refugees are living in low- and middle-income countries like Lebanon;https://www.news18.com/news/world/record-68-5-million-people-displaced-worldwide-says-un-1782879.html;Lebanon;33.83;35.83;0.0;neutral
migrants are what’s called forced migrants.;https://wtop.com/national/2018/06/forced-migration-from-central-america-5-essential-reads/;Mexico;23.0;-102.0;-0.3;negative
migrant is caught at the border:;https://caffeinatedthoughts.com/2018/06/how-to-address-the-problem-of-separating-families-at-the-border/;United States;38.0;-97.0;0.0;neutral
migrant children are seen at the Tornillo-Marcelino Serna Port of Entry in Tornillo, Texas;http://www.dailymail.co.uk/news/article-5859859/Trump-administration-discussed-policy-separating-mothers-children-YEAR.html;United States;38.0;-97.0;0.0;neutral
refugees is obvious, it has to be viewed within a larger narrative pertaining to the rapidly changing political landscape in Europe and the crises under way in the Middle East and North Africa.;https://www.middleeastmonitor.com/20180619-stop-the-wars-to-end-the-refugee-crisis/;Italy;42.83;12.83;0.0;neutral
migrants who are fleeing a crisis in their home country.;https://colombiareports.com/colombia-has-highest-number-of-internally-displaced-people/;Colombia;4.0;-72.0;0.0;neutral
asylum seekers are “economic migrants”, most Eritrean and Sudanese nationals are seeking protection from persecution and other serious human rights violations.;https://www.amnestyusa.org/reports/israel-african-asylum-seeker-deportations-and-voluntary-transfers-are-forced-and-illegal/;Israel;31.5;34.75;0.048;positive
migrants – is implemented here.;https://www.voiceofsandiego.org/topics/news/what-you-need-to-know-about-family-separations-at-the-border/;Mexico;23.0;-102.0;0.0;neutral
migrant children are allowed to stay with their parents.;https://www.newsmax.com/politics/bob-goodlatte-us-mexico-border-separation-policy/2018/06/19/id/867092/;United States;38.0;-97.0;0.0;neutral
migrants is 100% false,” he wrote.;https://thinkprogress.org/trump-smears-immigrants-in-tweet-d70dfb05839c-76d725114d8e-12995101e858-1a9aa3e5ac9e-f2e84f4abb50/;United States;38.0;-97.0;-0.4;negative
migrants are being held in a more traditional lockup: a federal prison.;https://www.portlandmercury.com/blogtown/2018/06/18/20679287/oregon-faces-its-own-immigration-detention-crisis;Mexico;23.0;-102.0;0.25;positive
refugee kids are opposed to what's going on.;https://www.metrotimes.com/news-hits/archives/2018/06/19/immigrant-children-ripped-from-families-land-in-michigan-heres-how-to-help;Guatemala;15.5;-90.25;0.0;neutral
migrant parents are being detained.;https://www.yahoo.com/news/hurdles-facing-parents-children-separated-u-border-224930279.html;United States;38.0;-97.0;0.0;neutral
migrants that is closely associated with a president who has called them rapists and wants to build a wall keeping them out.;https://uproxx.com/news/immigration-us-society/;Germany;51.0;9.0;0.2;positive
Refugee Day is commemorated every June 20 to remember the millions of families who live in great insecurity, and to honor their strength and resilience.;https://www.desmoinesregister.com/story/opinion/columnists/iowa-view/2018/06/18/what-makes-america-great-possibility-new-start/706206002/;United States;38.0;-97.0;0.468;positive
refugees is focused on helping refugees and other displaced people in countries close to their homelands so that they may return home safely and voluntarily.The United States has provided nearly $204 million in assistance to those displaced in Burma and Rohingya refugees and host communities in Bangladesh in direct response to the crisis that started in August 2017.;http://m.thedailynewnation.com/news/178562/world-refugee-day;Bangladesh;24.0;90.0;0.144;positive
migrant is convicted of the crime and sentenced to at least one year in prison.;https://www.theday.com/statenortheast-news/20180619/gop-immigration-bill-would-allow-lawsuits-against-x2018sanctuariesx2019-like-connecticut;United States;38.0;-97.0;-0.3;negative
refugees they are helping, and on the people who volunteer accommodation.;https://www.huffingtonpost.co.uk/entry/hosting-refugee_uk_5b27de06e4b0783ae12bd7fe;Syria;35.0;38.0;0.0;neutral
migrants — is down in Germany.;https://nypost.com/2018/06/19/media-hysteria-isnt-helping-break-the-immigration-deadlock-and-other-commentary/;United States;38.0;-97.0;-0.156;negative
refugee crisis is not over.;http://www.voxy.co.nz/national/5/313891;South Sudan;15.0;30.0;0.0;neutral
refugee camp is 17 years.;http://www.unhcr.org/innovation/future-looking-approach-energy-environment-angola/;Angola;-12.5;18.5;0.0;neutral
migrants are responsible for a 92% increase in reported violent crimes in Germany during 2015 and 2016.;https://www.prisonplanet.com/ny-times-smears-trump-over-migrant-link-to-crime-in-germany-but-hes-right.html;Germany;51.0;9.0;-0.3;negative
migrants are referred to the Justice Department for criminal prosecution.;https://www.washingtonexaminer.com/news/former-first-ladies-join-forces-to-condemn-family-separation-at-border;Mexico;23.0;-102.0;-0.4;negative
refugees are in Asia and Africa.;https://www.voanews.com/a/hundreds-of-thousands-of-child-migrants-detained-across-globe-reports-say/4445717.html;Central African Republic;7.0;21.0;0.0;neutral
refugees are women and children and in need of “specialised support”.;https://www.independent.co.uk/news/world/asia/rohingya-refugee-camps-safe-spaces-traumatised-women-girls-myanmar-burma-a8406746.html;Bangladesh;24.0;90.0;0.0;neutral
migrant is released while the claim is pending, it's extremely unlikely that the government will find him or her again.;http://www.beaufortobserver.net/Articles-NEWS-and-COMMENTARY-c-2018-06-18-296878.114136-The-truth-about-splitting-families-of-illegal-aliens-at-the-border.html;Mexico;23.0;-102.0;-0.5;negative
migrants is a gross injustice that is not supported by facts.;https://www.theguardian.com/us-news/2018/jun/19/despair-and-anger-at-donald-trumps-immigration-policy;United States;38.0;-97.0;0.0;neutral
migrants settle are:;https://www.cnn.com/2013/11/06/us/immigration-statistics-fast-facts/;United States;38.0;-97.0;0.0;neutral
Refugee Day is on 20 June.;http://www.unwomen.org/en/news/in-focus/world-refugee-day;Bangladesh;24.0;90.0;0.0;neutral
migrants who are minors.;https://www.10news.com/news/u-s-world/southwest-key-group-operating-shelter-for-migrant-children-thrust-into-immigration-debate;United States;38.0;-97.0;0.0;neutral
migrant crisis is now threatening to bring down Merkel’s own Christian Democratic (CDU) government.;https://consortiumnews.com/2018/06/19/immigration-divides-europe-and-the-german-left/;United States;38.0;-97.0;0.148;positive
Refugee Day is also a time to take note of the awe-inspiring courage;https://www.thelifeyoucansave.org/blog/id/1440/world-refugee-daysustaining-and-transformative-impact-from-our-recommended-charities;Serbia;44.0;21.0;0.0;neutral
migrants is being lost in the argument and how forced separation has cruelly turned children into pawns in a political tug of war.;https://deadline.com/2018/06/demian-bichir-criticizes-forced-separation-illegal-immigrant-children-human-shields-donald-trump-1202413610/;United States;38.0;-97.0;-0.433;negative
migrants are part of a community’s social fabric.;http://latinousa.org/2018/06/18/uscommunitiescansufferlongtermice/;Mexico;23.0;-102.0;0.033;positive
migrant workers are also overrepresented among college professors, engineers, mathematicians, nurses, doctors and dentists, to name a few,” the report says.;https://www.msn.com/en-us/news/world/the-united-states-is-the-top-destination-for-immigrants/ar-AAySth5;Mexico;23.0;-102.0;-0.2;negative
migrant children are being held in a tent city detention facility.;https://www.nbcnews.com/politics/immigration/first-lady-melania-trump-makes-statement-family-separations-protests-grow-n884081?cid=public-rss_20180619;United States;38.0;-97.0;0.0;neutral
asylum seekers is restricted by executive decisions, therefore, the policy and the decisions taken under it need to be transparent and clearly stated,” Allahar said.;http://www.guardian.co.tt/news/2018-06-18/venezuelans-plan-sue-state-over-asylum-policy;United States;38.0;-97.0;0.1;positive
refugees are never given the platform to narrate their own stories.;https://www.theguardian.com/commentisfree/2018/jun/19/i-used-to-distance-myself-from-my-refugee-identity-now-i-own-it;Australia;-27.0;133.0;0.6;positive
refugees are a burden on host societies and a potential security problem.;https://www.merip.org/mer/mer286/refugee-rights-hit-wall;Norway;62.0;10.0;0.0;neutral
migrant children is against EVERYTHING that we as a country stand for.;http://www.tbo.com/florida-politics/buzz/2018/06/19/outrage-over-zero-tolerance-policy-overtakes-florida-politics/;United States;38.0;-97.0;0.0;neutral
migrants who are denied asylum to their home countries within 14 days.;http://www.kcbd.com/story/38452542/ted-cruz-to-introduce-legislation-to-keep-undocumented-immigrant-families-together;United States;38.0;-97.0;0.0;neutral
Refugee Resettlement is no longer legally responsible for the children once they were placed in a sponsor's custody.;http://www.msn.com/en-us/news/us/us-officials-likely-lost-track-of-nearly-6000-unaccompanied-migrant-children/ar-AAySe95;Honduras;15.0;-86.5;0.2;positive
migrants is Soros’ plan.;http://www.investmentwatchblog.com/hungarys-orban-the-replacement-of-populations-is-under-way-in-europe-partly-because-speculators-like-george-soros-can-make-large-financial-profits/;United States;38.0;-97.0;0.0;neutral
migrants are abusing the immigration system.;https://www.newsbusters.org/blogs/latino/garvin-oliver/2018/06/19/crackdown-against-abuse-asylum-claims-sparks-panic-telemundo;North Korea;40.0;127.0;0.0;neutral
migrants is not to reduce the number of Hispanics, but because illegal residency is an affront to the rule of law.;http://thefederalist.com/2018/06/19/aggressive-deportations-bad-theyre-not-ethnic-cleansing/;Germany;51.0;9.0;-0.5;negative
Refugee Day is slated to be held very soon across the world.;http://www.dailymail.co.uk/news/article-5862317/World-Refugee-Day-need-know.html;United Kingdom;54.0;-2.0;0.2;positive
refugees are hoping their positive story will go a long way to smashing negative stereotypes.;http://www.starweekly.com.au/news/a-little-ray-of-sunshine/;Australia;-27.0;133.0;-0.041;negative
migrants and is working with the Consular Affairs Department and the Jamaican High Commission in London.;https://petchary.wordpress.com/2018/06/19/on-windrush-concerns-texan-cages-and-a-racist-census-a-terrible-world/;United Kingdom;54.0;-2.0;0.16;positive
refugees not a burden, rather they are welfare-enhancing assets.;https://www.brookings.edu/blog/up-front/2018/06/19/refugees-are-a-win-win-win-formula-for-economic-development/;Germany;51.0;9.0;0.0;neutral
migrants are seeking asylum in the US.The detainees from India is the largest group of detainees being held in Sheridan, wrote Congresswoman Suzanne Bonamici on her blog post.;https://www.ndtv.com/indians-abroad/52-indians-arrested-in-us-for-illegal-immigration-1870091;British Indian Ocean Territory;-6.0;71.5;0.0;neutral
Refugee Day is dedicated to raising awareness of the situation of refugees throughout the world.;http://www.xinhuanet.com/english/2018-06/20/c_137265968.htm;Switzerland;47.0;8.0;0.0;neutral
asylum seekers who are living in limbo in South Tel Aviv while they await a decision about their fate and their future.;http://jewishweek.timesofisrael.com/indecision-on-african-migrants-is-damaging-their-lives/;French Southern Territories;-43.0;67.0;0.0;neutral
refugee is someone who;https://editorials.voa.gov/a/world-refugee-day-2018/4445724.html;United States;38.0;-97.0;0.0;neutral
Refugee Day is an opportunity to see the humanity in ourselves and others.;https://forward.com/scribe/403534/jews-have-a-moral-obligation-to-support-refugees/;Rwanda;-2.0;30.0;0.0;neutral
