sentence;url;place;lat;lon;sentiment_score;sentiment
migrants are “lucky we aren’t executing them.”;https://www.huffingtonpost.com/entry/oregon-national-guard-facebook-post-migrants_us_5b30ef66e4b0040e274577a1;United States;38.0;-97.0;0.333;positive
Migrants are usually in rough shape by the time they reach the private Texas properties along the US-Mexico border.;https://www.businessinsider.com.au/texas-landowners-say-worn-out-immigrants-crossing-border-property-2018-6;Mexico;23.0;-102.0;-0.05;negative
migrants is set at US$10,000 to US$15,000, “although I have one right now for US$25,000,” an employee who asked not to be named told AFP.;https://www.malaymail.com/s/1645185/in-texas-border-towns-illegal-immigration-is-big-business;Mexico;23.0;-102.0;0.286;positive
migrants are a drain on the system and don’t pay their way.;http://banglamirrornews.com/2018/06/25/slash-obscene-home-office-fees-say-mps-and-campaigners/;United Kingdom;54.0;-2.0;0.0;neutral
refugees are currently living in Bangladesh, having fled atrocities perpetrated by Myanmar’s security forces last year, including the systematic burning of more than 350 villages.;https://reliefweb.int/report/world/2018-un-general-assembly-debate-responsibility-protect-and-prevention-genocide-war;Bangladesh;24.0;90.0;0.167;positive
migrants found not in need of protection should be returned to their country of origin, or barring that, the last safe third country they passed through prior to EU entry.;https://www.fort-russ.com/2018/06/will-bulgarias-anti-migration-actions-be-backed-by-the-eu/;Turkey;39.0;35.0;0.125;positive
refugees are living in the country.;https://tribune.com.pk/story/1741742/1-since-childhood-afghan-refugees-get-integrated-pakistani-society/;Afghanistan;33.0;65.0;0.0;neutral
migrants are asked to wait because of capacity issues.;https://www.elpasotimes.com/story/news/local/juarez/2018/06/25/juarez-mexico-pinched-influx-immigrants-and-deportees/726984002/;Mexico;23.0;-102.0;0.0;neutral
migrants is set at $10,000 to $15,000, “although I have one right now for $25,000,” an employee who asked not to be named told AFP.;https://www.capitalfm.co.ke/news/2018/06/texas-border-towns-illegal-immigration-big-business/;Mexico;23.0;-102.0;0.286;positive
refugee camp] is very useful.;http://www.heraldscotland.com/news/16280788.they-chopped-him-with-a-machete-and-burned-him-alive-rohingya-refugees-reveal-horrors-of-myanmar-violence/;Myanmar;22.0;98.0;0.39;positive
Asylum seekers who are already in the U.S., or at a U.S. port of entry, must meet the same standard as a refugee in order to receive asylum.;https://www.heritage.org/immigration/report/stopping-family-separation-requires-closing-loopholes-and-strengthening;Mexico;23.0;-102.0;0.0;neutral
refugees is at the top of Hungary’s agenda when it comes to relations with its neighbours, along with the position and status of Hungarians living in the region.;http://www.balkaninsight.com/en/article/hungary-s-foreign-minister-we-re-an-anti-migration-country--06-22-2018;Hungary;47.0;20.0;0.5;positive
Migrants are pictured aboard the German rescue vessel 'Lifeline' after being rescued in the Mediterranean.;http://www.dailymail.co.uk/news/article-5882187/Italys-League-advances-local-polls-amid-immigration-crackdown.html;Ukraine;49.0;32.0;0.0;neutral
refugees are not criminals.;http://www.theforecaster.net/the-universal-notebook-save-the-children/;United States;38.0;-97.0;0.0;neutral
migrant is in sanctuary because he was being threatened by the Guerilla Army in Guatemala;http://spectrumlocalnews.com/nc/triad/news/2018/06/24/sanctuary-immigrants-speak-out-on-border-crisis;Guatemala;15.5;-90.25;0.0;neutral
migrants belongings are piled on the floor inside the Catholic Charities of the Rio Grande Valley on Saturday, June 23, 2018, in McAllen, Texas.;http://www.gazettenet.com/At-hub-for-border-crossings-families-spread-throughout-US-18405514;United States;38.0;-97.0;0.0;neutral
refugees are women and children, many of whom flee across the border alone, under an unrelenting sun, hiding from gunmen, hungry, thirsty, and scared.;https://www.snewsnet.com/gear/golite-goaid-14000-shirts;United States;38.0;-97.0;0.5;positive
migrants who are rescued or intercepted at sea.;https://www.politico.eu/article/european-commission-pushes-council-to-revise-migration-plan-angela-merkel-jean-claude-juncker/;Germany;51.0;9.0;0.0;neutral
migrants are peaceful, law-abiding and unreceptive to the type of extremist politics that have plagued Europe.;http://www.dailypioneer.com/columnists/usual-suspects/indians-deserve-better-uk-student-visa-care.html;Japan;36.0;138.0;0.25;positive
