sentence;url;place;lat;lon;sentiment_score;sentiment
Asylum seekers are filling the city’s shelter system and costs are predicted to hit $64.5 million in the coming months.;http://lfpress.com/opinion/editorials/editorial-money-for-border-crisis-we-prefer-action/wcm/57f1d586-51ef-4e45-b804-d12f5aacfc43;Canada;60.0;-95.0;0.0;neutral
refugee needs/service are met.;https://reliefweb.int/report/united-republic-tanzania/supporting-burundian-refugees;Burundi;-3.5;30.0;0.0;neutral
migrants are pictured in front of the National Reception Center For Asylum Seekers in Tirana, Albania June 6, 2018.;https://www.reuters.com/article/us-europe-migrants-albania/migrant-numbers-leap-on-new-balkan-route-across-albania-idUSKCN1J41KP;Albania;41.0;20.0;-0.1;negative
Asylum seekers are provided with free, fully furnished accommodation while applications are considered.;http://www.dailymail.co.uk/news/article-5820395/Ethiopian-asylum-seeker-38-life-saving-chemotherapy-delayed-six-weeks-immigration.html;United Kingdom;54.0;-2.0;0.4;positive
migrants does not erase our shared humanity with men, women and children who seek our help.;https://www.azcentral.com/story/opinion/op-ed/lindavaldez/2018/06/07/immigrant-families-separation-judge-challenges-trump-zero-tolerance/681835002/;Mexico;23.0;-102.0;0.0;neutral
refugees are displayed in free-standing steel frames on the Green, and as murals on the exterior walls of churches and other buildings.;https://www.publicnewsservice.org/2018-06-08/immigrant-issues/photo-exhibit-highlights-contributions-of-immigrants/a62835-1;United States;38.0;-97.0;-0.163;negative
asylum seekers are kept in jail, even when they have not broken any laws.;https://wdef.com/2018/06/08/analysis-how-the-asylum-process-works-and-what-needs-to-change/;Ecuador;-2.0;-77.5;0.05;positive
migrants are being arrested, detained for extended periods, and deported – not having been charged with any crime.;https://www.counterpunch.org/2018/06/08/passive-protest-and-the-census-citizenship-question/;Mexico;23.0;-102.0;0.0;neutral
asylum seekers were not immediately known.;https://www.independent.ie/world-news/europe/children-among-dead-as-vehicle-crammed-with-asylum-seekers-crashes-in-greece-36989293.html;Turkey;39.0;35.0;0.0;neutral
migrants are core constituencies of our unions and we need to speak up for them,” he said.;http://www.peoplesworld.org/article/as-republicans-resist-labor-tackles-comprehensive-immigration-reform/;United States;38.0;-97.0;0.0;neutral
Refugee Commission is completely overwhelmed, said the Minister of Human Rights, while acts of discrimination and xenophobia in Uruguay are emerging.;http://en.mercopress.com/2018/06/07/the-uruguayan-foreign-ministry-describes-the-number-of-immigrants-arriving-in-the-country-as-never-seen-before;United States;38.0;-97.0;0.05;positive
migrant children are being expelled to Niger as countries across Europe and North Africa seek to curtail irregular migration, the UN children's fund UNICEF said Friday.;http://www.xinhuanet.com/english/2018-06/09/c_137240690.htm;Niger;16.0;8.0;0.0;neutral
migrants who are fleeing unspeakable violence in their home countries, but also inflicts further trauma by separating children from their parents,” said Carper.;https://www.markey.senate.gov/news/press-releases/markey-joins-feinstein-colleagues-in-introducing-legislation-to-halt-separation-of-immigrant-families;Brazil;-10.0;-55.0;0.0;neutral
refugee claimants are directed to go for help with their claim and to arrange for their basic needs until their Immigration and Refugee Board hearing.;https://www.winnipegfreepress.com/local/winnipeg-non-profit-overwhelmed-by-influx-of-asylum-seekers-from-quebec-484910273.html;Canada;60.0;-95.0;0.0;neutral
migrants are pictured in front of the National Reception Center For Asylum Seekers in Tirana, Albania;http://www.dailymail.co.uk/news/article-5821859/People-smugglers-open-new-Balkan-route-migrants-Albania.html;Albania;41.0;20.0;-0.1;negative
refugees are a recurring topic in Lebanon's political debate, but Bassil has taken a hard line and is the only leading politician directly attacking the UN.;http://en.rfi.fr/wire/20180608-lebanon-blocks-unhcr-residency-permits-over-syria-refugee-spat-0;Lebanon;33.83;35.83;-0.048;negative
Refugee Agency, is counting on the generosity of Muslims to allocate their Zakat to refugee families before the end of the Holy Month.;http://www.islamicfinance.de/?q=node/11307;United States;38.0;-97.0;0.0;neutral
refugee policies are in violation of prevailing law.;http://www.spiegel.de/international/germany/angela-merkel-is-no-longer-the-queen-of-europe-a-1211950.html;United States;38.0;-97.0;0.0;neutral
migrants are only expected to stay for about four months until ICE makes more space available.;http://revolutionradio.org/2018/06/08/trump-moves-1600-immigrant-detainees-to-federal-prisons-as-ice-scrambles-to-find-space/;United States;38.0;-97.0;0.2;positive
refugees and are now full citizens, is the legitimate expression of the self-determination of an oppressed indigenous, Middle Eastern people.;http://jewishrefugees.blogspot.com/2018/06/saudi-slams-all-or-nothing-approach-to.html;Germany;51.0;9.0;0.175;positive
migrants are the backbone of the industry but that their contributions are marginalized and ignored.;http://www.wmfe.org/anthony-bourdain-chef-and-television-host-has-died-at-61/87734;United States;38.0;-97.0;0.0;neutral
refugees are a recurring topic in Lebanon's political debate, but Bassil has taken a hard line and been the only leading politician directly attacking the UN.;http://www.france24.com/en/20180608-lebanon-blocks-unhcr-residency-permits-over-syria-refugee-spat;Lebanon;33.83;35.83;-0.048;negative
migrant crisis is already stirring a political backlash.;https://www.ynetnews.com/articles/0,7340,L-5281994,00.html;Iraq;33.0;44.0;0.0;neutral
migrants are treated fairly, with the dignity and respect they deserve, and in a way consistent with how we would expect to be treated.;https://www.realclearscience.com/articles/2018/06/08/ice_misusing_science_to_determine_age_of_immigrants_110668.html;Afghanistan;33.0;65.0;0.475;positive
Asylum seekers do not belong in prisons, nor do people pursuing lawful avenues to stay with their families in the U.S.”;https://www.officer.com/command-hq/corrections/news/21008478/ice-sending-1000-immigrant-detainees-to-victorville-california-prison;Mexico;23.0;-102.0;0.0;neutral
refugee crisis is a huge burden on the Lebanese economy and demographics;https://www.aljazeera.com/news/2018/06/lebanon-freezes-unhcr-staff-permits-syria-refugees-spat-180608193601201.html;Lebanon;33.83;35.83;0.4;positive
refugees are displaced again after they return.;http://humanitariannews.org/20180608/afghanistan-afghan-electorate-basic-needs-must-be-met-political-progress-can-be-ensured;Norway;62.0;10.0;0.0;neutral
migrants are “cutting in line.” And turning healthcare into a government-run program, he says, is simply a way to make it more expensive.;http://www.capoliticalreview.com/capoliticalnewsandviews/quick-takes-a-dozen-things-we-learned-from-californias-primary/;Spain;40.0;-4.0;-0.15;negative
refugees are still alive.;http://www.thejewishstar.com/stories/marchs-mallory-israel-is-a-human-rights-crime,15609;Israel;31.5;34.75;0.1;positive
asylum seekers are reportedly being held in another part of the SeaTac prison, according to NWIRP.;https://www.seattlemet.com/articles/2018/6/7/immigrant-mothers-separated-from-their-children-held-at-seatac;United States;38.0;-97.0;0.0;neutral
asylum seekers who are separated from their families.;https://www.democracynow.org/2018/6/8/headlines/ice_to_transfer_1_600_immigrants_to_prisons_in_unprecedented_move;United States;38.0;-97.0;0.0;neutral
migrants are not threats to the society.;https://www.dailysabah.com/op-ed/2018/06/08/turkey-a-historical-sanctuary-for-refugees;Turkey;39.0;35.0;0.0;neutral
refugees are living' said TEDx Kakuma Camp co-curator Melisa Flemming.;https://www.cnn.com/2018/06/08/africa/tedx-event-refugee-camp-kenya/;Uganda;1.0;32.0;0.0;neutral
Asylum seekers are not legally entitled to an attorney, and lacking money or resources, a majority end up facing the immigration judge and government lawyer alone.;https://www.cbsnews.com/news/seeking-asylum-an-immigrants-journey-to-america-cbsn-originals/;Mexico;23.0;-102.0;-0.1;negative
refugees are a recurring topic in Lebanon's political debate, but Bassil has taken a hard line and been the only leading politician directly attacking the U.N.;http://www.naharnet.com/stories/en/247107-bassil-freezes-unhcr-residency-permits-over-refugee-spat;Lebanon;33.83;35.83;-0.048;negative
migrant populations is also a mounting concern.;https://www.prisonplanet.com/migrant-crime-against-germans-soars-23-per-cent-in-a-single-year.html;Germany;51.0;9.0;0.0;neutral
refugee is not featured in any of these photos.;http://www.hrc.org/blog/chechen-refugee-and-leader-of-rainbow-railroad-join-hrc-for-meetings-in-was;Canada;60.0;-95.0;0.0;neutral
asylum seekers are being held.;https://www.thestranger.com/slog/2018/06/08/27294111/where-are-their-children-local-leaders-seek-information-about-detained-asylum-seekers-in-seatac;Mexico;23.0;-102.0;0.0;neutral
migrant flows are simply forcing them elsewhere.;https://www.cfr.org/blog/nigerian-minister-warns-against-nigerian-citizens-seeking-asylum-germany;Morocco;32.0;-5.0;0.0;neutral
asylum seekers are highly motivated individuals who are more than willing to work at any job they can find.;http://edmontonjournal.com/opinion/letters/fridays-letters-kenneys-actions-speak-louder-than-words;Canada;60.0;-95.0;0.303;positive
migrants are detained, they are sent to other facilities run by the Department of Health and Human Services' Office of Refugee Resettlement.;https://townhall.com/columnists/donaldlambro/2018/06/08/trumps-treatment-of-migrant-children-is-wrong-n2488534;Mexico;23.0;-102.0;-0.062;negative
migrants are transferred for prosecution, without access to medical care.;https://www.voiceofsandiego.org/topics/government/detainees-and-courts-are-dealing-with-intense-strain-under-new-border-policy-court-docs-show/;United States;38.0;-97.0;0.0;neutral
"refugee camp is like.""";https://www.aljazeera.com/indepth/features/juggling-trauma-palestinian-circus-tackles-refugee-crisis-180607203144817.html;Germany;51.0;9.0;0.0;neutral
"asylum seekers who are fleeing persecution and torture.""";https://www.channelnewsasia.com/news/world/us-democrats-blast-use-of-federal-prisons-to-house-detained-immigrants-10412404;United States;38.0;-97.0;0.0;neutral
migrants is a good example.;http://www.ekathimerini.com/229397/opinion/ekathimerini/comment/turkey-eu-when-the-carrots-dont-work;Turkey;39.0;35.0;0.7;positive
asylum seekers who are fleeing persecution and torture.”;http://www.newsindiatimes.com/u-s-democrats-blast-use-of-federal-prisons-to-house-detained-immigrants/35973;United States;38.0;-97.0;0.0;neutral
refugees have not been fulfilled yet, noting that voluntary repatriation may not take place in safety and dignity.;http://www.presstv.com/Detail/2018/06/08/564370/Lebanon-Syria-UNHCR-refugee;Syria;35.0;38.0;0.0;neutral
migrants not only immersed themselves into work, but strived to become a part of American society, while still retaining their Armenian heritage.;https://armenianweekly.com/2009/03/01/the-armenian-in-chicago/;United States;38.0;-97.0;0.0;neutral
"refugees are some sort of danger, or threat to national security, or are unwelcome in our streets, I have one very clear message: That kind of thinking is as un-American as it is un-Christian.""";https://www.voanews.com/a/immigration-news-recap-june-3-9-/4430762.html;Myanmar;22.0;98.0;0.365;positive
refugees are required to register in person for voluntary repatriation to Namibia from 11th May 2018 to 11th July 2018,” the notice reads.;https://www.newera.com.na/2018/06/08/botswana-activates-cessation-clause-on-namibian-refugees/;Namibia;-22.0;17.0;0.0;neutral
migrants are being separated at the border.;https://www.houstonpublicmedia.org/articles/news/politics/immigration/2018/06/07/289970/turner-joins-other-mayors-asking-government-to-stop-separation-of-immigrant-families/;United States;38.0;-97.0;0.0;neutral
Refugee Agency, are on ground providing food and clean water, safe shelter, and medical and psychological support to those in need.;http://saudigazette.com.sa/article/536546/Life/Fashion/Lets-make-giving-a-trend-this-Ramadan;United States;38.0;-97.0;0.217;positive
migrants is partly based on a fear of Islam.;https://drrichswier.com/2018/06/08/i-didnt-leave-the-catholic-church-but-pope-francis-has-left-us-catholics/;Afghanistan;33.0;65.0;0.0;neutral
asylum seekers are terrorists.;https://www.gazettelive.co.uk/news/teesside-news/terrorism-cost-lack-mosque-north-14760410;United Kingdom;54.0;-2.0;0.0;neutral
refugees are a result of your pal Barack Insane Obama and his fellow Communists.;http://www.freerepublic.com/focus/f-religion/3661670/posts;Turkey;39.0;35.0;-1.0;negative
refugees are distributed in several hundreds of sites across the nation [25,30].;http://journals.plos.org/plospathogens/article?id=10.1371/journal.ppat.1007014;Lebanon;33.83;35.83;0.0;neutral
migrants is so terrible, so ugly, so cruel, it's hard to wrap your head around it.;https://crooksandliars.com/2018/06/daca-student-murdered-after-deportation;Mexico;23.0;-102.0;-0.748;negative
migrants who are not superheroes.;http://allafrica.com/stories/201806080505.html;France;46.0;2.0;0.0;neutral
migrants who are affected, but to some extent anyone who picks up a second language.;http://www.bbc.com/future/story/20180606-can-you-lose-your-native-language;United States;38.0;-97.0;0.0;neutral
migrant community is the New York Immigrant Family Unity Project (NYIFUP) — the nation’s first universal legal defense program for immigrants facing deportation.;http://www.gothamgazette.com/opinion/7725-new-york-city-will-protect-due-process-for-all-in-the-trump-era;United States;38.0;-97.0;0.147;positive
refugees are stopped and sent back by Libyan or Tunisian coastguards, sponsored by EU governments.;https://www.euractiv.com/section/future-eu/news/trans-europe-express-mass-orbanisation-on-the-horizon/;Serbia;44.0;21.0;0.0;neutral
asylum seekers are denied because of court rulings and obscure laws like the one that prevent people like ACM from gaining asylum—people fleeing extreme persecution who would seem to be perfect candidates for asylum.;https://www.motherjones.com/politics/2018/06/she-was-enslaved-by-salvadoran-guerrillas-us-judges-say-that-makes-her-ineligible-for-asylum/;United States;38.0;-97.0;0.438;positive
Refugee Resettlement are in charge of children who are unaccompanied.;http://mynorthwest.com/1013093/seatac-mothers-separated-immigration/;Mexico;23.0;-102.0;0.0;neutral
Migrants frequently are associated with negative stereotypes and labels, including being possible rapists, incompatible with European culture, invaders, freeloaders and even worse, terrorists.;https://www.dailysabah.com/op-ed/2018/06/09/eu-migration-policy-in-africa-pushes-migrants-to-risk-perilous-journeys-to-reach-europe;Chad;15.0;19.0;-0.12;negative
refugees and is the only leading politician directly attacking the UN.;http://www.dw.com/en/lebanon-blocks-unhcr-workers-visa-applications-in-syrian-refugee-row/a-44133044;Lebanon;33.83;35.83;0.05;positive
migrants is an important element in the management or illegal migration and the prevention of the creation of new migratory routes.;http://www.ekathimerini.com/229435/article/ekathimerini/news/eu-says-greece-turkey-readmission-deal-required-for-visa-waiver;Turkey;39.0;35.0;0.012;positive
Refugees International is a wholly-independent;https://reliefweb.int/report/world/un-must-address-protection-issues-global-compact-migration;Switzerland;47.0;8.0;0.0;neutral
"asylum seekers are big issues in today's society.""";http://www.greenocktelegraph.co.uk/news/16272604.Inspirational_pupils_moved_by_Anne_Frank__39_s_story_to_address_Scottish_Parliament_on_the_holocaust_victim__39_s_birthday/;United Kingdom;54.0;-2.0;0.0;neutral
migrants are welcome, and that “we must end acts of racism, violence, and threats towards all.”;http://nwasianweekly.com/2018/06/school-principal-on-leave-amid-harassment-complaints/;Vietnam;16.0;106.0;0.8;positive
migrants are reported as trying to cross from Bosnia-Herzegovina into Croatia via the border city of Bihac.;http://www.infomigrants.net/en/post/9777/balkan-states-come-together-to-prevent-further-migrant-crisis;Croatia;45.17;15.5;0.0;neutral
refugees not to voluntarily go back home.;https://aawsat.com/english/home/article/1294226/lebanon-freezes-unhcr-residency-applications;Syria;35.0;38.0;0.0;neutral
refugee camps are a fundamental aspect of a resilient Palestinian national identity and a reaffirmation of their right to return (a questionable statement in and of itself);http://www.transconflict.com/2018/06/ain-al-hilweh-redux-whats-still-palestinian-in-those-refugee-camps-076/;Lebanon;33.83;35.83;-0.107;negative
migrant children are taken from their parents?;https://www.theguardian.com/us-news/2018/jun/08/nearly-1800-immigrant-families-separated-at-us-border-in-four-months;United States;38.0;-97.0;0.0;neutral
refugees are returning to their home country for the Ramadan holiday after the Turkish army liberated terrorist hotbeds near the border.;https://www.aa.com.tr/en/middle-east/-syrians-return-home-to-spend-ramadan-holiday-/1169352;Turkey;39.0;35.0;0.1;positive
migrants are fleeing the war in Syria, with the European Union receiving almost a quarter of a million asylum requests from April through June.;https://www.dawn.com/news/1208229/thousands-more-migrants-pour-into-austria-13-drown-off-turkey;Serbia;44.0;21.0;0.0;neutral
migrants are included, overall illegal crossings are 2½ times higher than last year at this time.;http://www.gopusa.com/illegal-alien-children-on-border-quadrupled-in-may/;United States;38.0;-97.0;-0.062;negative
refugees is limited, and many Lebanese won’t hire Syrians, so refugees have to be entrepreneurial while faced with laws that are not in their favor: They[...];http://humanitariannews.org/20180608/how-determined-refugee-went-customer-business-partner;Syria;35.0;38.0;0.214;positive
migrants is beginning to lose its sting.;https://morningstaronline.co.uk/article/meeting-sets-agenda-confronting-hostile-environment;Austria;47.33;13.33;0.0;neutral
"migrant children"" are in the custody of the government, according to the Washington Post.";http://aldianews.com/articles/politics/immigration/despite-us-intimidation-immigrant-presence-mexico-border-increases;Mexico;23.0;-102.0;0.0;neutral
migrant children are being expelled to Niger as countries across Europe and North Africa seek to curtail irregular migration, the UN Children’s Fund (UNICEF) said on Friday.;https://sundiatapost.com/2018/06/08/unicef-says-migrant-children-expelled-to-niger-as-europe-north-africa-tighten-borders/;Niger;16.0;8.0;0.0;neutral
refugees must not be objects for political bargaining,” she emphasised.;http://assembly.coe.int/nw/xml/News/News-View-EN.asp?newsid=7105&cat=134;Syria;35.0;38.0;0.0;neutral
refugees are made to jump through make them feel unwanted.;https://www.timesofmalta.com/articles/view/20180608/local/refugees-having-to-relocate-because-they-feel-unwanted.681157;Malta;35.83;14.58;0.0;neutral
migrant children are placed with sponsors who are carefully screened.;http://www.startribune.com/separations-of-families-create-horrendous-ordeal-for-kids/484998161/;Mexico;23.0;-102.0;-0.1;negative
migrants are held, tortured, and killed, according to the United Nations.;http://news.trust.org/item/20180608114722-0hns8;Germany;51.0;9.0;-0.2;negative
asylum seekers are being kept in “cages”;https://www.vox.com/2018/6/8/17429670/democrats-trump-family-separation-policy-border;Honduras;15.0;-86.5;0.0;neutral
refugees are voluntarily returning.;https://www.albawaba.com/news/lebanese-fm-lashes-out-unhcr-intimidating-syrian-refugees-return-1143008;Syria;35.0;38.0;0.0;neutral
refugees have not attended school in years after fleeing violence in their homeland.;https://georgiabulletin.org/news/2018/06/congress-speakers-emphasize-strong-messages-of-faith-joy/;United States;38.0;-97.0;0.0;neutral
Asylum seekers are a daily topic as prosecutors investigate the Bremen office of the immigration office, known by its German acronym BAMF, for improperly approving over 1,000 asylum applications.;https://global.handelsblatt.com/politics/murder-suspect-flee-germany-iraqi-refugee-susanna-932902;Germany;51.0;9.0;0.0;neutral
refugees are some sort of danger, or threat to national security, or are unwelcome in our streets, I have one very clear message: That kind of thinking is as un-American as it is un-Christian.';https://www.bignewsnetwork.com/news/257447541/immigration-news-recap-june-3-9;Myanmar;22.0;98.0;0.365;positive
Refugees are welcome here!”.;https://eurasianet.org/s/russian-speaking-lgbt-activists-paint-a-rainbow-in-new-york;United States;38.0;-97.0;1.0;positive
refugee backgrounds are vulnerable to excessive family control, fetishisation, and marrying young under duress.;https://www.nzherald.co.nz/nz/news/article.cfm?c_id=1&objectid=12066919;New Zealand;-41.0;174.0;-0.217;negative
migrant crime is touchy for the establishment parties in Germany, all of which supported Merkel’s open borders policy for illegal migrants.;https://legalinsurrection.com/2018/06/germany-refugee-suspected-of-rape-and-murder-of-14-year-old-jewish-girl/;United States;38.0;-97.0;-0.25;negative
"refugees are required to register in person for voluntary repatriation to Namibia from 11th May 2018 to 11th July 2018,"" the notice reads.";http://allafrica.com/stories/201806080780.html;Namibia;-22.0;17.0;0.0;neutral
refugees are stuck in protracted situations with little prospect of returning home anytime soon.;https://www.msn.com/en-us/news/world/commentary-a-brutal-us-refugee-policy/ar-AAyp4cv;Myanmar;22.0;98.0;-0.188;negative
refugees are such a windfall for the EU, as the European Commission and many of our own MEPs are so fond of telling us, then why not keep this goody bag of ‘cultural diversity’ all to ourselves?;https://www.timesofmalta.com/articles/view/20180608/letters/migrants-inflow.681149;Italy;42.83;12.83;0.24;positive
Asylum seekers do not belong in prisons, nor do people pursuing lawful avenues to stay with their families in the U.S.;http://www.inlandnewstoday.com/story.php?s=50984;United States;38.0;-97.0;0.0;neutral
refugee camps, is leading the mission.;https://borneobulletin.com.bn/volunteers-bangladesh-bound-for-aid-mission/;Bangladesh;24.0;90.0;0.0;neutral
migrants do not wait in Canada for years as their asylum claims are processed.;https://www.reddeeradvocate.com/news/canada-has-removed-only-a-fraction-of-thousands-of-illegal-border-crossers/;Canada;60.0;-95.0;0.0;neutral
asylum seekers are accommodated in the centre, according to official figures.;https://reliefweb.int/report/world/officials-push-information-exchange-arrivals-western-balkan-meeting;Serbia;44.0;21.0;0.0;neutral
migrant sentiment is echoedby a presidential administration that calls certain undocumented immigrants “animals” and repeatedly focuses on efforts to build a multi-billion-dollar wall along the Mexico–United States border.;https://www.teenvogue.com/story/claudia-gomez-gonzalez-was-killed-by-a-customs-and-border-protection-agent;Mexico;23.0;-102.0;0.214;positive
migrants who are registered as having arrived by sea to Italy this year is 77.44 per cent lower than that reported last year in the same period;https://reliefweb.int/report/italy/mediterranean-migrant-arrivals-reach-33400-2018-deaths-reach-785;Italy;42.83;12.83;0.0;neutral
Refugees is collecting new unwrapped toys and books.;https://newtownbee.com/the-top-of-the-mountain-249/;United States;38.0;-97.0;0.136;positive
refugees are being affected.;https://www.bigissue.com/latest/politics/refugees-are-ending-up-homeless-within-days-of-being-granted-asylum/;United Kingdom;54.0;-2.0;0.0;neutral
migrant children are being expelled to Niger as countries across Europe and North Africa seek to curtail irregular migration;https://www.unicef.org/press-releases/migrant-children-expelled-niger-growing-numbers-europe-and-north-africa-tighten;Niger;16.0;8.0;0.0;neutral
migrant children are being processed;https://www.rawstory.com/2018/06/us-urges-judge-toss-lawsuit-immigrant-children-detention/;United States;38.0;-97.0;0.0;neutral
refugees do not willingly leave in search of new or better opportunities.;https://www.broadwayworld.com/chicago/article/In-Honor-Of-World-Refugee-Day-National-Hellenic-Museum-Unveils-Newest-Exhibition-In-June-20180607;United States;38.0;-97.0;0.17;positive
refugees issue is the winning card which means the end of the Israeli state” — today;http://www.camera.org/article/noura-erakat-rewrites-hamas-and-rebrands-return/;United States;38.0;-97.0;0.5;positive
asylum seekers are repeatedly denied entry at the border due to the Trump administration’s “zero-tolerance” immigration policy.;https://thinkprogress.org/ice-sent-him-back-to-mexico-he-was-killed-weeks-later-086f4555d651/;Mexico;23.0;-102.0;-0.125;negative
refugees are being lauded as a landmark move sending a powerful message to the lawless country’s criminal networks.;https://thinkprogress.org/u-n-sanctions-libyas-human-traffickers-without-acknowledging-e-u-role-9105d09bd0cf/;Hungary;47.0;20.0;-0.05;negative
refugees is on a mandate that has not changed since 2012.;https://www.novinite.com/articles/190563/The+Bulgarian+Foreign+Minister+Seeks+a+Joint+Claim+for+Indemnification+for+Thracian+Refugees;Bulgaria;43.0;25.0;0.0;neutral
