sentence;url;place;lat;lon;sentiment_score;sentiment
migrant children are set to endure a separate nightmare in the coming months, fanned out across the country to detention centers where they will await legal judgement.;http://inthesetimes.com/article/21224/chinga-la-migra-border-patrol-family-separation-donald-trump-jeff-sessions;United States;38.0;-97.0;0.2;positive
asylum seekers are not subject to arrest as border jumpers are.;http://www.gopusa.com/kasich-bush-join-uproar-against-zero-tolerance-border-policy/;United States;38.0;-97.0;0.017;positive
refugees are struggling to adapt to their new country, suffering from xenophobia and racism, and the constant threat of being repatriated.;https://theculturetrip.com/europe/greece/articles/the-refugee-food-festival-is-coming-back-to-athens/;United States;38.0;-97.0;0.068;positive
"asylum seekers are forced to make their refugee claims in the first ""safe"" country where they arrive, unless they qualify for an exception.";https://www.globalcitizen.org/en/content/canada-zero-tolerance-border-policy/;United States;38.0;-97.0;0.15;positive
migrant boys are detained;http://www.dailymail.co.uk/news/article-5858095/All-five-living-Ladies-including-Melania-condemn-separating-immigrant-families.html;Mexico;23.0;-102.0;0.0;neutral
asylum seekers are turned away before they have a chance to file their papers.;https://www.ktoo.org/2018/06/19/murkowski-zeroes-in-on-trump-admin-to-stop-splitting-families-at-border/;United States;38.0;-97.0;0.0;neutral
migrant policy is widely blamed for the rise of the right-wing AfD, now the main opposition party in Germany's Parliament.;https://www.nbcnews.com/news/world/trump-takes-aim-merkel-over-immigration-crime-germany-n884221?cid=public-rss_20180619;Germany;51.0;9.0;0.033;positive
refugees are taking part in a basketball masterclass with BC Khimki, as part of events in Moscow.;http://www.unhcr.org/news/stories/2018/6/5b2789aa4/live-blog-world-refugee-day-events-span-globe-displacement-hits-record.html;Russian Federation;60.0;100.0;0.0;neutral
refugees are welcome here” has been a powerful slogan of opposition to the Trump administration’s massive reduction in the number of refugees admitted to the country.;https://www.merip.org/mer/mer286/editorial;Australia;-27.0;133.0;0.367;positive
migrant parents is being widely condemned, he asks what policy will prevent the suicide of America.;http://americanfreepress.net/trump-and-the-invasion-of-the-west/;United States;38.0;-97.0;-0.1;negative
refugees are being forced to remain at the country's only resettlement centre, in Mangere, south Auckland, for weeks on end, because they can't find permanent homes.;http://www.stuff.co.nz/national/politics/104837520/nz-works-to-double-refugee-quota-as-others-close-their-borders;New Zealand;-41.0;174.0;-0.15;negative
migrant community, are Latinos.;http://www.wbtv.com/story/38451457/charlotte-immigrant-business-owners-react-to-deportation-policy;Guatemala;15.5;-90.25;0.0;neutral
migrants are being treated like animals in cages, Trump’s use of a word which likens them to locusts destroying crops is indicative of how the president may view these people in need.;https://www.mediaite.com/online/trump-bashes-dems-with-false-claim-they-are-responsible-for-border-policy-they-want-migrants-to-infect-our-country/;Germany;51.0;9.0;-0.2;negative
migrants — not solely to aid those in need, but because it is good for the city economy, a city council committee heard Monday.;http://lfpress.com/news/local-news/londons-slowing-population-growth-wake-up-call-for-city;Syria;35.0;38.0;0.7;positive
refugees are children, and 4% are elderly.;https://reliefweb.int/report/jordan/unhcr-jordan-factsheet-june-2018;Syria;35.0;38.0;0.0;neutral
migrant parents are deported from the United States, their children return with them, Sessions added.;https://www.bustle.com/p/jeff-sessions-says-separating-families-isnt-like-nazi-germany-itll-make-your-head-spin-9487370;Germany;51.0;9.0;0.0;neutral
migrant children are being ripped away from their parents and housed in detention centers with “prison-like” conditions.;http://samuel-warde.com/2018/06/migrant-children-administration-lies/;United States;38.0;-97.0;0.0;neutral
refugees is focused on helping refugees and other displaced people in countries close to their homelands so that they may return home safely and voluntarily.;https://www.thedailystar.net/opinion/human-rights/opportunity-reflect-the-suffering-the-displaced-1592266;Myanmar;22.0;98.0;0.188;positive
migrant families are sometimes taken abroad to their respective home countries and married off.;https://www.prisonplanet.com/swedish-liberals-seek-to-arm-authorities-with-travel-ban-to-stop-forced-marriage.html;Sweden;62.0;15.0;0.125;positive
Refugee Day is as much about celebrating the diverse contribution former refugees make to New Zealand, as it is about recognising the situation of refugees across the world.;http://www.scoop.co.nz/stories/PO1806/S00216/red-cross-urges-action-on-refugee-quota-on-world-refugee-day.htm;New Zealand;-41.0;174.0;0.112;positive
asylum seekers are receiving as a result of recent policy changes by Attorney General Jeff Sessions.;http://newsregister.com/article?articleTitle=letters-to-the-editor-june-15-2018--1529215572--29887--;United States;38.0;-97.0;0.025;positive
refugees are in developing countries, many of which are desperately poor and receive little support to care for these populations.;https://gulfnews.com/news/europe/other/number-forced-to-flee-homes-hit-record-in-2017-un-1.2238947;Honduras;15.0;-86.5;-0.029;negative
migrant children are shown walking in single file between tents in their compound next to the Mexican border in Tornillo, Texas;http://www.dailymail.co.uk/news/article-5861295/Plans-detention-center-undocumented-children-Houston-spark-fury.html;United States;38.0;-97.0;-0.024;negative
refugees is sheltering in poor or middle-income countries, which, according to Grandi should help dispel the perception that the refugee crisis “is a crisis of the rich world.;https://www.unmultimedia.org/avlibrary/asset/2180/2180361/;Switzerland;47.0;8.0;-0.013;negative
migrants who are rescued at sea.The migrants were met by emergency workers, health officials, Red Cross volunteers and psychologists at the city's marina.;https://www.sott.net/article/388634-Migration-debate-roils-Europe-meanwhile-sea-convoy-reaches-Spain;Hungary;47.0;20.0;0.0;neutral
migrant policy is “inhumane.”;http://www.news1130.com/2018/06/19/global-refugee-numbers-reach-record-high-u-s-and-canada-take-in-record-numbers/;United States;38.0;-97.0;-0.9;negative
"Refugee Resettlement is housing 11,786 immigrant children in ""an elaborate network"" of facilities in 17 states.";http://freebeacon.com/issues/trump-stands-by-family-separation-policy-as-hill-gop-scrambles-for-solution/;United States;38.0;-97.0;0.5;positive
"migrants are dropped off at a bus station shortly after being released from detention through ""catch and release"" immigration policy in McAllen, Texas.";https://gulfnews.com/news/americas/usa/all-5-us-first-ladies-speak-out-on-family-separations-at-border-1.2239003;United States;38.0;-97.0;0.0;neutral
refugees are stuck in Turkey, unable to pass through to Europe.;http://www.itv.com/news/2018-06-19/refugees-selling-organs/;Turkey;39.0;35.0;-0.5;negative
migrants who are able to reach Italy?;https://sputniknews.com/analysis/201806191065562039-no-common-european-policy/;Italy;42.83;12.83;0.5;positive
migrant girls are being held and where most of the young children have been imprisoned.;http://hollywoodlife.com/2018/06/19/donald-trump-new-immigration-policy-separates-families/;United States;38.0;-97.0;0.3;positive
migrants they are ILLEGAL.;https://www.azcentral.com/story/opinion/op-ed/laurieroberts/2018/06/19/zero-tolerance-immigrant-children-torn-their-parents-families-separated/712779002/;United States;38.0;-97.0;-0.5;negative
refugees are living in just a handful of countries closest to conflict zones;https://www.independent.co.uk/news/world/world-refugee-day-2018-un-report-figures-unhcr-syria-rohingya-a8404446.html;Jordan;31.0;36.0;0.0;neutral
migrants are en route to the EU via emerging pathways.;https://europe.infowars.com/eu-border-agency-preparing-for-surge-of-migrants/;Serbia;44.0;21.0;0.0;neutral
migrants are illegally crossing the Bosnian border from Serbia and Montenegro, using Bosnia as a new transit route on their way to Western Europe.;https://www.independentsentinel.com/80k-migrants-head-for-europe-as-merkel-fights-to-survive/;Bosnia and Herzegovina;44.0;18.0;-0.121;negative
"migrants are coming to the border, instead of the embassies, to claim asylum, is by Daniel Horowitz at Conservative Review, headlined ""The Immorality of Open Borders.""";https://www.americanthinker.com/blog/2018/06/as_the_press_whips_up_emotion_in_child_migrant_feeding_frenzy_sensible_solutions_get_obscured.html;Japan;36.0;138.0;0.0;neutral
refugees are living in developing countries, and 80 per cent are in countries next door to their own, UNHCR said.;https://www.theglobeandmail.com/world/article-asylum-claims-doubled-in-canada-last-year-un-says/;Norway;62.0;10.0;0.3;positive
"migrants are being treated as criminals,"" shouted Miriam Vargas Corona, executive director of Unidos, a nonprofit serving immigrant families in Yamhill County.";https://www.statesmanjournal.com/story/news/2018/06/18/trump-immigration-policy-oregon-vigil-federal-prison/712119002/;Honduras;15.0;-86.5;0.0;neutral
Refugees are fleeing violence, war and persecution.;https://www.aljazeera.com/news/2018/06/refugee-agency-record-685-million-displaced-worldwide-180619065028702.html;Yemen;15.0;48.0;0.0;neutral
migrants who are in Spain after their rescue boat was rejected by other European governments are requesting to be granted asylum in France.;http://www.wbal.com/article/319987/158/the-latest-vatican-mexico-lament-suffering-of-migrant-kids;France;46.0;2.0;-0.062;negative
refugees are located in two: Douala and Yaoundé.;https://www.cgdev.org/blog/many-refugees-developing-countries-are-located-near-urban-job-opportunities;Cameroon;6.0;12.0;0.0;neutral
refugees are being hosted by developing countries, many of which receive little international support to help care for them.;http://www.onuitalia.com/2018/06/19/world-refugee-day-iom-mediterranean-arrivals-under-half-of-last-year/;South Sudan;15.0;30.0;0.104;positive
migrant issue is a political wildfire in Europe.;http://www.startribune.com/trump-steps-into-europe-s-migration-fray/485876821/;Italy;42.83;12.83;0.0;neutral
migrant children are shown outside a former Job Corps site that now houses them, Monday, June 18, 2018, in Homestead, Fla.;https://www.reviewjournal.com/news/politics-and-government/nevada/nevada-lawmakers-candidates-weigh-in-on-immigration-separation/;United States;38.0;-97.0;0.0;neutral
migrants are fraudulently using children to pose as family units to help themselves gain entry to the US.;http://www.dailymail.co.uk/news/article-5860735/PIERS-MORGAN-Weeping-kids-snatched-immigrant-parents-obscenity-shames-America.html;Mexico;23.0;-102.0;0.0;neutral
migrants is 'NO MORE';https://www.news24.com/World/News/papa-papa-audio-of-children-stokes-rage-over-separation-20180619;Mexico;23.0;-102.0;-0.25;negative
refugee office is housing and caring for nearly 12,000 immigrant children, according to Steve Wagner, ACF’s acting assistant secretary.;https://www.bloomberg.com/news/articles/2018-06-19/trump-migrant-child-detentions-mean-458-million-for-nonprofit;United States;38.0;-97.0;0.05;positive
migrant children are facing now.;http://www.newsweek.com/caged-child-immigration-child-detention-center-trump-protest-viral-photo-983992;United States;38.0;-97.0;0.0;neutral
migrants are in bondage debt to the violent cartels who let them pass through their border territory.;http://www.breitbart.com/2018-elections/2018/06/18/dhs-nielsen-defends-rule-law-media-urges-her-stop-enforcement/;Central African Republic;7.0;21.0;-0.8;negative
migrants — are ravaging our community.;https://moguldom.com/149017/wespotlight-venture-capital-chinedu-enekwe/;Central African Republic;7.0;21.0;0.0;neutral
migrants are using their children to play on American sympathy and gain access to the United States, and they must be stopped.;http://www.ahherald.com/columns-list/armchair-critic/25581-separation-policy;United States;38.0;-97.0;0.0;neutral
refugee status, are to be handled by the country where the person first arrived.;https://ipolitics.ca/2018/06/19/minister-defends-refugee-deal-with-u-s-as-calls-grow-for-it-to-be-cancelled/;United States;38.0;-97.0;0.25;positive
asylum seekers are legitimate.;http://www.israelnationalnews.com/Articles/Article.aspx/22330;United States;38.0;-97.0;0.0;neutral
asylum seekers is restricted by executive decisions, therefore, the policy and the decisions taken under it need to be transparent and clearly stated, Allahar said.;http://www.petroleumworld.com/story18061904.htm;Russia;60.0;100.0;0.1;positive
refugee issue is…;https://www.thetimes.co.uk/edition/ireland/europe-must-act-to-avoid-rise-of-hard-right-ppb8f7wx5;Italy;42.83;12.83;0.0;neutral
refugee camp is not,” said Matteo Salvini, Italy’s deputy prime minister, in a tweet.;https://www.reddeeradvocate.com/opinion/dyer-migrants-the-borders-are-closing/;Italy;42.83;12.83;0.0;neutral
refugees are currently living, and the meetings turned his mind to how he could help.;https://www.newcastlestar.com.au/story/5474568/giving-refugees-a-new-home-through-theatre-project/?cs=1913;Australia;-27.0;133.0;0.0;neutral
refugees is likely illegal.;https://www.sott.net/article/388600-HRW-Bill-Clintons-laws-created-a-shameful-immigration-system-of-mass-detention-and-abuse-of-refugees-and-migrants;Honduras;15.0;-86.5;-0.25;negative
migrants are likely to become U.S. citizens under the House compromise bill.;https://www.cato.org/blog/82-dreamers-wont-benefit-house-bills-citizenship-path;United States;38.0;-97.0;0.0;neutral
Refugee Resettlement is no longer legally responsible for the children once they are homed with a sponsor.;https://www.politicususa.com/2018/06/19/its-worse-than-you-imagined-trump-has-likely-lost-nearly-6000-unaccompanied-children.html;Mexico;23.0;-102.0;0.2;positive
migrants are seen here inside a detention center with mattresses and thermal blankets on the floor.;https://www.deseretnews.com/article/900022117/hatch-to-ask-justice-dept-to-suspend-family-separation-while-congress-seeks-solution.html;United States;38.0;-97.0;-0.1;negative
migrants and is now duly delivering while simultaneously pretending that the inevitable consequences are nothing to do with him.;https://www.the-pool.com/news-views/politics/2018/25/Gaby-Hinsliff-on-Melania-Trump-hate-to-see-families-separated;Mexico;23.0;-102.0;0.0;neutral
"migrants are ""pouring"" into the United States, and his political opponents wanted them to ""infest"" the country.";https://www.msn.com/en-gb/news/world/donald-trump-says-illegal-immigrants-are-infesting-america-in-chilling-message/ar-AAyRHkA;Mexico;23.0;-102.0;0.0;neutral
refugees alone are believed to range between international estimates of 650,000 and governmental ones of 1.4 million.;http://www.mei.edu/content/article/jordan-must-find-long-term-stability;Canada;60.0;-95.0;0.0;neutral
refugees is focused on helping refugees and other displaced people in countries close to their homelands, so that they may return home safely and voluntarily.;https://www.dhakatribune.com/opinion/op-ed/2018/06/20/on-world-refugee-day;Bangladesh;24.0;90.0;0.188;positive
asylum seekers is rafted across the Rio Grande from Mexico into Texas on June 12, 2018 in McAllen, Texas.;https://www.news.com.au/lifestyle/parenting/kids/shocking-audio-captures-border-agent-joking-as-separated-migrant-kids-cry/news-story/8430732eca4f6dfd19d7e8123f622b55;Mexico;23.0;-102.0;0.0;neutral
refugees are especially responsive to a welcoming climate, and are more likely to stay with an employer once they find it.;https://www.newsdeeply.com/refugees/community/2018/06/19/why-hiring-refugees-is-good-for-business;United States;38.0;-97.0;0.167;positive
refugee abusers are guarding our Parliament” and “Vic Govt — Refuse to be complicit”.;http://junkee.com/wilson-security-protest-parliament/164037;Nauru;-0.53;166.92;0.0;neutral
refugees are generally better off than the host population.;https://www.businessdailyafrica.com/datahub/Gap-narrows-on-economic-welfare-of-refugees/3815418-4620708-jb65cb/;Kenya;1.0;38.0;0.5;positive
migrant parents are allowed to stay with their kids.;https://www.mediaite.com/online/ted-cruz-to-introduce-first-gop-bill-to-keep-migrant-families-together-all-americans-are-rightly-horrified/;United States;38.0;-97.0;0.0;neutral
migrants is Samaritas, the largest refugee resettlement agency in Michigan and fourth-largest in the country.;https://www.battlecreekenquirer.com/story/news/local/michigan/2018/06/19/immigrant-children-michigan-foster-care/711174002/;United States;38.0;-97.0;0.0;neutral
refugees are a temporary phenomenon and will soon be returning home.;https://www.brookings.edu/blog/order-from-chaos/2018/06/19/when-refugee-displacement-drags-on-is-self-reliance-the-answer/;Turkey;39.0;35.0;0.0;neutral
migrants are best understood not as hardened criminals, but as indicators of a more serious underlying problem.;http://www.foxandhoundsdaily.com/2018/06/want-take-border-seriously-ask-california-done/;Mexico;23.0;-102.0;0.389;positive
migrants are mothers, and sometimes fathers, with children.;https://nacla.org/blog/2018/06/19/no-way-home;United States;38.0;-97.0;0.0;neutral
refugee camps are fenced in.;https://grapevine.is/news/2018/06/19/icelanders-protest-us-border-policy-european-refugee-policy/;Luxembourg;49.75;6.17;0.0;neutral
Refugee Day, is a time for solidarity with refugees – and with the communities that welcome them.;http://www.unhcr.org/news/press/2018/6/5b28bef94/statement-un-high-commissioner-refugees-filippo-grandi-world-refugee-day.html;Germany;51.0;9.0;0.8;positive
refugees are living in low and middle-income countries such as Lebanon, Pakistan and Uganda, Grandi said.;http://www.taipeitimes.com/News/world/archives/2018/06/20/2003695207;Pakistan;30.0;70.0;0.0;neutral
"migrants are refugees are receiving from the immigration authorities, through a platform called ""Families Belong Together"".";http://fairydetox.org/2018/06/19/children-separated-from-parents-at-us-border-heard-crying.html;Mexico;23.0;-102.0;0.0;neutral
Refugee Week is the perfect opportunity for Deliveroo to help the chefs involved take the next step in their dream of a permanent restaurant with its own bricks-and-mortar site.;https://www.standard.co.uk/go/london/restaurants/refugee-chefs-invited-to-cook-at-welcome-kitchens-popup-a3866256.html;Yemen;15.0;48.0;0.533;positive
migrant children are kept back in 2014.;https://www.desmoinesregister.com/story/news/politics/2018/06/19/steve-king-iowa-republicans-david-young-bob-vander-plaats-trump-children-zero-tolerance-immigration/713323002/;United States;38.0;-97.0;0.0;neutral
migrants are calling on western nations to intervene in the South East Asian nation, warning of decades of war crimes and human rights violations.;https://www.sbs.com.au/news/myanmar-ethnic-groups-call-on-the-australian-government-for-help;Myanmar;22.0;98.0;0.0;neutral
migrants could not be used as an effort to deter asylum-seekers, according to one ruling.;https://www.nbcnews.com/storyline/immigration-border-crisis/fact-check-did-obama-administration-separate-families-n884856;Argentina;-34.0;-64.0;0.0;neutral
migrant children are being held.;https://www.businessinsider.in/where-are-the-girls-reporters-press-the-trump-administration-to-release-information-and-images-of-detained-migrant-girls-and-toddlers/articleshow/64655846.cms;United States;38.0;-97.0;0.0;neutral
migrants are returned by the Libyan Coast Guard, Grandi tossed a bouquet of flowers into the water to honour the memory of the lives lost at sea.;http://www.unhcr.org/news/latest/2018/6/5b294cb64/vulnerable-refugees-evacuated-libya-during-visit-unhcr-head.html;Libya;25.0;17.0;0.0;neutral
migrant workers are also overrepresented among college professors, engineers, mathematicians, nurses, doctors and dentists, to name a few.”;http://www.newsweek.com/united-states-top-destination-immigrants-not-best-place-be-foreigner-985056;Mexico;23.0;-102.0;-0.2;negative
Refugee Resettlement is now housing at least 11,000 children in 100 shelters in 17 states.;https://www.freep.com/story/news/politics/2018/06/19/immigration-detention-centers-wherearethegirls-girls-toddlers/714227002/;United States;38.0;-97.0;-0.3;negative
asylum seekers are allowed to enter the country while they wait for their cases to be reviewed.;https://www.msn.com/en-au/news/world/a-nasty-immigration-fight-could-cost-german-chancellor-angela-merkel-her-job/ar-AAyQ54r;Germany;51.0;9.0;0.0;neutral
asylum seekers are successful, against 94% of Syrians, 92% of Eritreans, and 69% of Somalis.;http://northafricapost.com/24170-over-10000-algerians-sought-asylum-in-europe-in-2017-eurosat.html;Netherlands;52.5;5.75;0.75;positive
asylum seekers are not the primary motivation for the Left’s push for total amnesty.;https://sfcmac.wordpress.com/2018/06/19/dont-separate-illegal-alien-families-at-the-border-send-them-all-back-home-together/;Congo, The Democratic Republic of the;0.0;25.0;0.133;positive
refugee crisis is now well understood.;https://www.pressherald.com/2018/06/19/commentary-satellites-map-our-dismal-water-future/;United States;38.0;-97.0;0.0;neutral
"refugees are ""more vulnerable than ever"".";http://asianews.it/news-en/For-Caritas-Lebanon,-the-refugee-burden-is-unsustainable,-peace-in-Syria-is-urgent-44200.html;Iran;32.0;53.0;0.0;neutral
migrants are putting their children at risk.;http://www.vindy.com/news/2018/jun/19/abolish-appalling-detention-program-now-/;Germany;51.0;9.0;0.0;neutral
migrants are part of an “invisible government” tied to the “communistic Jew” and to “Jewish international financiers.”;https://forward.com/news/breaking-news/325895/what-americans-had-to-say-about-jewish-war-refugees/;United States;38.0;-97.0;0.0;neutral
refugees did not commit any crimes;http://www.rtvslo.si/news-in-english/summer-at-kolpa-no-less-tourists-than-before/458444;Slovenia;46.0;15.0;0.0;neutral
migrants are “violently” changing the country’s culture.;https://www.yahoo.com/news/trump-claims-german-crime-way-221815504.html;Germany;51.0;9.0;-0.8;negative
refugees do not live in camps.;https://www.economist.com/the-economist-explains/2018/06/19/why-most-refugees-do-not-live-in-camps;Bangladesh;24.0;90.0;-0.068;negative
migrants are from Asia and Latin America.;https://www.firstpost.com/world/us-zero-tolerance-immigration-policy-donald-trumps-a-team-hunkers-down-as-outrage-explodes-unleashes-data-to-support-its-stance-4545681.html;Mexico;23.0;-102.0;0.0;neutral
migrants are up 50,000 for the second month in a row.;http://www.investmentwatchblog.com/borders-language-and-culture-how-this-immigration-crisis-is-overblown-and-why-it-is-exactly-what-politicians-want/;Mexico;23.0;-102.0;0.0;neutral
asylum seekers is restricted by executive decisions, therefore, the policy and the decisions taken under it need to be transparent and clearly stated.”;http://www.nationnews.com/nationnews/news/168583/venezuelans-threaten-sue-asylum-policy;United States;38.0;-97.0;0.1;positive
refugees are not only confined to the US and the Mediterranean.;http://www.advertiser.ie/galway/article/101375/galway-to-spell-out-a-filte-to-refugees;Afghanistan;33.0;65.0;0.0;neutral
refugees are languishing in Bangladeshi refugee camps, after fleeing a brutal army campaign launched in August last year.;https://www.business-standard.com/article/news-ani/rohingya-camp-leader-murdered-in-bangladesh-118061900194_1.html;Bangladesh;24.0;90.0;-0.438;negative
migrants are now detained and prosecuted, and their children are removed and held in separate detention centres.;https://www.msn.com/en-gb/news/world/united-states-to-withdraw-from-un-human-rights-council-as-criticism-mounts-over-border-policy/ar-AAySrJO;Mexico;23.0;-102.0;0.0;neutral
"Refugees Day is commemorated as wars and civil strife multiply and many families are forced to flee their homes,"" she said.";https://www.dailytrust.com.ng/-21-000-cameroonian-refugees-currently-in-nigeria-257079.html;Nigeria;10.0;8.0;0.067;positive
migrant children is immoral and reprehensible.;http://boston.cbslocal.com/2018/06/19/maura-healey-democratic-attorneys-general-trump-border-separation-children/;United States;38.0;-97.0;0.0;neutral
migrants are granted permanent legal status each year – far more than any other country.;http://www.delcotimes.com/opinion/20180619/chris-freind-is-gop-snatching-defeat-from-jaws-of-victory-in-immigration-debacle;North Korea;40.0;127.0;0.169;positive
migrants not to break our laws.;http://www.foxcarolina.com/story/38458784/jeff-duncan-says-children-of-illegal-immigrants-shouldnt-be-used-as-human-get-out-of-jail-free-cards;United States;38.0;-97.0;0.0;neutral
migrants would not be separated from their families or guardians while in the custody of the Department of Homeland Security.;https://www.carolinajournal.com/news-article/n-c-s-congressional-delegation-opposes-family-separation-cant-agree-on-fix/;United States;38.0;-97.0;0.0;neutral
refugee status are correct, invoking scripture to support a heinous policy should be a concern for all Christians.;http://www.butlereagle.com/article/20180619/EDITORIAL02/706199893;Christmas Island;-10.5;105.67;0.0;neutral
refugees are languishing in Bangladesh refugee camps, after fleeing a brutal Myanmar army campaign launched in August last year.;https://www.siasat.com/news/rohingya-camp-leader-murdered-bangladesh-1370653/;Bangladesh;24.0;90.0;-0.438;negative
